tweet_id,timestamp,tweet_text,matched_disaster_keywords,matched_crisis_keywords,hashtags,post_url,sentiment_score
6566534742,2025-02-26 20:30:56,"police_car_light  winter storm warning issued february 26 at 1128am akst until february 27 at 1200am akst by nws juneau ak police_car_light 
additional details here","storm, storm warning",warning,,https://bsky.app/profile/jnu.nws-bot.us/post/3lj47tomum42y,-0.34
23734722,2025-02-26 20:29:29,sophie storm,storm,None,,https://bsky.app/profile/morpheuscometh.bsky.social/post/3lj47qzgzh22u,0.0
66225347732,2025-02-26 20:29:00,ajk continues winter storm warning for municipality of skagway ak till feb 27 1200 am akst link,"storm, storm warning",warning,,https://bsky.app/profile/ajk.weather.im/post/3lj47q73wlm2h,-0.34
43472,2025-02-26 20:28:34,"371


flogging molly  the lightning storm",storm,None,#lookandplay #musicchallenge,https://bsky.app/profile/nickname76.bsky.social/post/3lj47pgonxc2l,0.0
536243472,2025-02-26 20:27:11,"severe flooding hit coalfields in southern west virginia over the weekend of february 16th causing one death and intensive damage locals stated that the damage from the storm was unlike any seen in the last 20 years read more 
image west virginia watch","flood, flooding, storm","damage, death",,https://bsky.app/profile/isciences.bsky.social/post/3lj47mucscc2f,-0.9169
77273472,2025-02-26 20:26:36,"in general peter thiel and his cronies have been planning and thinking about this for more than 10 years and trump was a perfect storm for them to come in and finally get their vision moving 

this video does a great job summarizing everything",storm,None,,https://bsky.app/profile/rachitdubey.bsky.social/post/3lj47lupgzc2o,0.8689
6235274347722,2025-02-26 20:26:14,"dear cdc a killer virus has landed on us soil
i understand if it takes you a moment to send in hypodermicwielding storm troopers but cant you at least have a fing press conference",storm,None,,https://bsky.app/profile/ispeaktruth2u.bsky.social/post/3lj47l7xd2s2f,-0.2144
24634722,2025-02-26 20:23:09,"deep in my blood
i know we were born
to be happy together
for the time that it lasts
for your love was a calming storm",storm,blood,,https://bsky.app/profile/cloudlicker.bsky.social/post/3lj47fpo2kk2q,0.891
523472,2025-02-26 20:22:31,"fire  blood descent  chapter 35 fire 

matic thought he was unstoppableuntil his storm was silenced and shadows severed

read now
athenastarrcastory",storm,blood,#pnr #enemiestolovers #darkromance #booktok #paranormalromance #fantasy #moralgrayheroes #radishfiction #inkitt,https://bsky.app/profile/authorathenastarr.bsky.social/post/3lj47enleep2z,-0.743
2634772,2025-02-26 20:22:37,"brace yourselves feds the current calm is just the eye of a much larger storm

reduction in force guidance was just issued to all agencies",storm,None,#rip2025 #rif #doge #opm #omb,https://bsky.app/profile/drtravis.bsky.social/post/3lj47eglf7s2y,0.0
3436347462,2025-02-26 20:22:13,"i have read there is also an expansionupdate kit to the desert storm game included
i wonder if it makes the game slightly better in the event card play the only thing it did not impress me much",storm,None,,https://bsky.app/profile/6xwa.bsky.social/post/3lj47e46oqc2b,0.382
22634732,2025-02-26 20:22:14,"some screenshots from the titan expedition in no mans sky

three of these are mandatory photo objectives and one is a cool pyramid that someone built im not taking credit for that one",None,shot,#nomanssky,https://bsky.app/profile/solgeonsolray.bsky.social/post/3lj47dzb3mk2m,-0.1984
43347742,2025-02-26 20:19:44,fascism is washing away american media like its a sandcastle in a storm surge,"storm surge, storm",None,,https://bsky.app/profile/pjkool.bsky.social/post/3lj477oou4c2e,0.3612
254234772,2025-02-26 20:19:37,in this dramatic painting from 1867 gustave courbet records his visit during a violent storm to saint aubin sur mer on the normandy coast courbet rarely chose to show a human presence in his seascapes so the inclusion of a figure makes the painting all the more interesting,storm,dramatic,,https://bsky.app/profile/ahistoryinart.bsky.social/post/3lj477fpygc2l,-0.228
7564334746622,2025-02-26 20:17:58,my storm mermaid paper doll for the san diego comiccon art show in july its been 8 years excited to be participating again,storm,None,#sdcc #stormxmen #ororomunroe #punkstorm #mohawkstorm #fanart #xmen #mermaid #bipocart #paperdoll,https://bsky.app/profile/jessicayambao.bsky.social/post/3lj474f6i622r,0.4003
2353472322,2025-02-26 20:16:48,i dont know youre industry but you and others do and you all know what you need best  get together brain storm and make solutions that work for all of you,storm,None,,https://bsky.app/profile/jackmahogoff.bsky.social/post/3lj472g3sj22l,0.8338
36454346642,2025-02-26 20:16:08,cloud_with_lightning  arrr matey on this here map ye see the greens dominatin the east and west coasts hintin at above normal rain the south be sportin a touch o orange fer below normal the rest be near normal like a calm sea before a storm fair winds ahead cloud_with_rain pirate_flag,storm,None,,https://bsky.app/profile/joshualeone.bsky.social/post/3lj46za64fv2v,0.7707
7672634662,2025-02-26 20:15:32,"the administrator i see youre as grumpy as ever coming in at this time porter
the storm you know the night shift is what i prefer
the administrator yeah but im not gonna have the three of you sparring in the middle of the night",storm,None,,https://bsky.app/profile/lurkinginshadow.bsky.social/post/3lj46y6bqln2n,0.1531
4266563462,2025-02-26 20:15:17,um im actually for this  if anyone near me wants to storm a tesla dealership and drive the cars off a mountain pass please reach out  i think im good for two drivers,storm,None,,https://bsky.app/profile/eobardtron.bsky.social/post/3lj46xpcrbk2n,0.6486
625673462,2025-02-26 20:12:00,is  this the same commando was in a previous video  he was crawling across a field with his fellow commando on crutches to storm a ukrainian position,storm,None,,https://bsky.app/profile/davehaterofracism.bsky.social/post/3lj46rtxgos2w,0.0
642227347426,2025-02-26 20:31:16,what is this thunderstorm,"storm, thunderstorm",None,,https://bsky.app/profile/xoloash.bsky.social/post/3lj47uc4nwc26,0.0
453565346725,2025-02-26 20:08:19,"thanks to bskysocial for this commission
urgh it takes a lot of protein and stuff to get this dog fueled up for a big long football game its not like i have to hold it the whole game but the thunderstorm in my belly tends to really get rumbling in the locker room afterwards","storm, thunderstorm",None,,https://bsky.app/profile/bulldawgnate4.bsky.social/post/3lj46l7tfvc25,0.1747
666242346447626,2025-02-26 20:00:05,"spc feb 26 2025 2000 utc day 1 convective outlook
cloud_with_lightning_and_rain no severe thunderstorm areas forecasttornado 
additional details here","storm, thunderstorm",None,,https://bsky.app/profile/spc-storms.nws-bot.us/post/3lj464jh47626,-0.3818
666242344623,2025-02-26 19:40:05,"spc feb 26 2025 1930 utc day 3 severe thunderstorm outlook
cloud_with_lightning_and_rain no severe thunderstorm areas forecasttornado 
additional details here","storm, thunderstorm",None,,https://bsky.app/profile/spc-storms.nws-bot.us/post/3lj44yqxot623,-0.6369
536524234423,2025-02-26 19:30:03,"bskysocial 

mobile_phone_with_arrow   hey do you wanna come over tonight theres supposed to be a thunderstorm and i wanna spend it getting smothered by you instead of flinching at the thunder","storm, thunderstorm",None,,https://bsky.app/profile/kitty-cxnt.bsky.social/post/3lj44grlpas23,-0.2942
22273344222,2025-02-26 19:22:55,once i get my layouts made its gonna be far more thunderstorm themed than icesnow themed at least for twitch stuff i dont know if ill use my other sonas to vtube for more than short lil bits so idk fuwjjd,"storm, thunderstorm",None,,https://bsky.app/profile/frostyfiend.bsky.social/post/3lj4422sqbs2u,-0.2183
735334342,2025-02-26 19:20:50,so instead of doing this this wiredfiber networks on the ground were just going to hope a thunderstorm or kessler event doesnt ground a bunch of planes,"storm, thunderstorm",None,,https://bsky.app/profile/jason0x21.bsky.social/post/3lj43we4bis2w,0.4404
6733542,2025-02-26 17:45:18,in case youre wondering how my day is going im having to hold my dog because hes cartoonishly chattering his teeth in fear of the thunderstorm outside,"storm, thunderstorm",None,,https://bsky.app/profile/notquiteapex.net/post/3lj3wlk54bk2z,-0.4939
33433227,2025-02-26 17:44:06,"this rain is okay but i need a severe thunderstorm to improve my wellness 
this first quarter of 2025 sucks i need happy asap","storm, thunderstorm",None,,https://bsky.app/profile/amadorlicea.bsky.social/post/3lj3wjejmy227,0.8201
7227332,2025-02-26 17:43:53,were in the midst of a neofascist thunderstorm bathed in new technologies that are not controlled by the people of course the machine will be used against us even though we are the ones operating and fixing the engines,"storm, thunderstorm",None,,https://bsky.app/profile/notaderepudio.bsky.social/post/3lj3wixkygc2d,0.0
6662423352,2025-02-26 17:40:05,"spc feb 26 2025 1730 utc day 2 convective outlook
cloud_with_lightning_and_rain no severe thunderstorm areas forecasttornado 
additional details here","storm, thunderstorm",None,,https://bsky.app/profile/spc-storms.nws-bot.us/post/3lj3wc5pzzo2h,-0.3818
74473322,2025-02-26 17:36:04,no severe storms in the outlook today but this is the thunderstorm outlook for today it looks like southern ohio and a big part of kentucky are in the thunderstorm outlook area,"storm, thunderstorm, severe storm",None,,https://bsky.app/profile/billwx.bsky.social/post/3lj3w2ydtfc2l,0.5916
236333423,2025-02-26 17:19:14,"orbs close encounter after thunderstorm



time 12 july 2024 2017 pm location switzerland background i went jogging it started to rain heavy and a thunderstorm arised after escaping the thunderstorm from the forest i","storm, thunderstorm",None,,https://bsky.app/profile/ufofeed.bsky.social/post/3lj3v4uojon23,0.0516
3265334226,2025-02-26 17:11:14,"went to take photos of the abandoned hotels by hotel 2 i ended up taking shelter inside because of a thunderstorm incredibly eerie pt 3

camera  nikon l35af
film_frames  fujifilm superia 400
round_pushpin  kupari dubrovnik croatia","storm, thunderstorm","dead, shelter",#believeinfilm #filmphotography #filmisnotdead #35mm #analoguephotgraphy #analogphotography,https://bsky.app/profile/domkiote.seeks.quest/post/3lj3uoi4ty226,-0.7257
3624273332,2025-02-26 17:06:54,"rainsnow mix continues across parts of the area heading into the afternoon hours on this wednesday

an isolated thunderstorm or two remains possible particularly nearsouth of the i94 corridor","storm, thunderstorm",None,,https://bsky.app/profile/southmiwx.com/post/3lj3ugttiy32k,-0.3182
666242332,2025-02-26 16:40:05,"spc feb 26 2025 1630 utc day 1 convective outlook
cloud_with_lightning_and_rain no severe thunderstorm areas forecasttornado 
additional details here","storm, thunderstorm",None,,https://bsky.app/profile/spc-storms.nws-bot.us/post/3lj3swveoia2j,-0.3818
23362,2025-02-26 16:35:12,"ind issues a strong thunderstorm will impact portions of southern hancock northwestern rush and southwestern henry counties through 1145 am est wind 30 mph hail 000 in
at w at wed 26 feb 2025 161658 0000 via iembot
additional details here","storm, thunderstorm",None,,https://bsky.app/profile/ind.nws-bot.us/post/3lj3so6auin2y,0.5574
255363322,2025-02-26 16:19:43,the trend continues to get drier and drier for tomorrow may be tough to squeeze out a tenth of an inch unless you get lucky enough for a thunderstorm,"storm, thunderstorm",None,,https://bsky.app/profile/rowancountyweather.bsky.social/post/3lj3rsgfvw22l,0.3182
532773332,2025-02-26 16:17:00,a strong thunderstorm will impact portions of southern hancock northwestern rush and southwestern henry counties through 1145 am est wind 30 mph hail 000 in link,"storm, thunderstorm",None,,https://bsky.app/profile/ind.weather.im/post/3lj3rnmlkqd2g,0.5574
3333472,2025-02-26 16:23:53,"new weather advisory special weather statement 

at 1116 am est doppler radar was tracking a strong thunderstorm near greenfield or 14 miles east of indianapolis moving east at 50 mph hazardwinds in excess of 30 mph sourceradar indicated see more watchedskysocialappalerts","storm, thunderstorm",None,,https://bsky.app/profile/skeetbot.watchedsky.social/post/3lj3rzxc47o2n,0.7184
233362,2025-02-26 16:15:10,"ind issues a strong thunderstorm will impact portions of northwestern shelby southwestern hancock and central marion counties through 1130 am est wind 40 mph hail 000 in
at at wed 26 feb 2025 160109 0000 via iembot
additional details here","storm, thunderstorm",None,,https://bsky.app/profile/ind.nws-bot.us/post/3lj3rke3vy62j,0.5574
536243472,2025-02-26 20:27:11,"severe flooding hit coalfields in southern west virginia over the weekend of february 16th causing one death and intensive damage locals stated that the damage from the storm was unlike any seen in the last 20 years read more 
image west virginia watch","flood, flooding, storm","damage, death",,https://bsky.app/profile/isciences.bsky.social/post/3lj47mucscc2f,-0.9169
666242346447626,2025-02-26 20:00:05,"spc feb 26 2025 2000 utc day 1 convective outlook
cloud_with_lightning_and_rain no severe thunderstorm areas forecasttornado 
additional details here","storm, thunderstorm",None,,https://bsky.app/profile/spc-storms.nws-bot.us/post/3lj464jh47626,-0.3818
73227345324,2025-02-26 19:55:18,heads up a spring storm system will bring a severe threat to the south tuesday into wednesday next week stay tuned tornado,storm,None,,https://bsky.app/profile/dylanfedericowx.bsky.social/post/3lj45tlx3jk24,-0.7639
744734562,2025-02-26 19:53:45,"what is a special marine warning

a severe local storm warning affecting coastal water areas or a warning of potentially hazardous weather conditions usually of short duration 2 hours or less and","storm, storm warning","conditions, warning",,https://bsky.app/profile/dkwhattopoly.bsky.social/post/3lj45r6fkds2x,-0.7269
666242344623,2025-02-26 19:40:05,"spc feb 26 2025 1930 utc day 3 severe thunderstorm outlook
cloud_with_lightning_and_rain no severe thunderstorm areas forecasttornado 
additional details here","storm, thunderstorm",None,,https://bsky.app/profile/spc-storms.nws-bot.us/post/3lj44yqxot623,-0.6369
6662423352,2025-02-26 17:40:05,"spc feb 26 2025 1730 utc day 2 convective outlook
cloud_with_lightning_and_rain no severe thunderstorm areas forecasttornado 
additional details here","storm, thunderstorm",None,,https://bsky.app/profile/spc-storms.nws-bot.us/post/3lj3wc5pzzo2h,-0.3818
3345346633522,2025-02-26 16:43:33,"catherine the princess of wales and prince william prince of wales visit pontypridd market on february 26 2025 in pontypridd wales 
in december 2024 pontypridd was one of a number of towns across wales which was hit by severe flooding as a result of storm bert and storm darragh","flood, flooding, storm",None,#royal,https://bsky.app/profile/naida46.bsky.social/post/3lj3t52hpuc2z,-0.3182
666242332,2025-02-26 16:40:05,"spc feb 26 2025 1630 utc day 1 convective outlook
cloud_with_lightning_and_rain no severe thunderstorm areas forecasttornado 
additional details here","storm, thunderstorm",None,,https://bsky.app/profile/spc-storms.nws-bot.us/post/3lj3swveoia2j,-0.3818
556223333322,2025-02-26 15:36:25,from daily weather forecasts severe storm warnings and climate monitoring to fisheries management noaas products and services are essential to us economic strength noaa is in fact a paragon of efficiency accomplishing a vast public safety mission with far fewer resources than it requires,"storm, severe storm, storm warning","safety, warning",,https://bsky.app/profile/johndospassosc.bsky.social/post/3lj3pf333t22b,0.5719
543322,2025-02-26 13:22:08,"already keeping an eye on our next potential big storm system early next week 

the storm prediction center already has a slight risk for strong to severe storms next tuesday for portions of arkansas more details to come over the next few days","storm, severe storm",None,#arwx,https://bsky.app/profile/austinburkeswx.bsky.social/post/3lj3huuxzd22w,-0.0953
6662423332,2025-02-26 12:40:05,"spc feb 26 2025 1300 utc day 1 convective outlook
cloud_with_lightning_and_rain no severe thunderstorm areas forecasttornado 
additional details here","storm, thunderstorm",None,,https://bsky.app/profile/spc-storms.nws-bot.us/post/3lj3fjqfp3a2y,-0.3818
36274332,2025-02-26 12:00:48,major storm system targets east texas to mississippi valley next tuesday highconfidence forecast shows 70f dewpoints with severe storm potential uncertainty remains about specific hazards but conditions look increasingly favorable for significant severe weather outbreak,"storm, severe storm",conditions,,https://bsky.app/profile/noagendamedia.bsky.social/post/3lj3ddjceuo2i,0.1154
3335725,2025-02-26 10:14:56,"the storm prediction center issues day 7 15 any severe convective risk at feb 26 954z for portions of hgx
at wed 26 feb 2025 095600 0000 via iembot
additional details here",storm,None,,https://bsky.app/profile/hgx.nws-bot.us/post/3lj35g7dfvb25,-0.5719
352454335226,2025-02-26 10:13:43,"the storm prediction center issues day 7 15 any severe convective risk at feb 26 954z for portions of meg
at wed 26 feb 2025 095600 0000 via iembot
additional details here",storm,None,,https://bsky.app/profile/mem.nws-bot.us/post/3lj35e2evun26,-0.5719
74644233522,2025-02-26 10:12:12,"the storm prediction center issues day 7 15 any severe convective risk at feb 26 954z for portions of lzk
at wed 26 feb 2025 095600 0000 via iembot
additional details here",storm,None,,https://bsky.app/profile/lit.nws-bot.us/post/3lj35bdef2q2n,-0.5719
447727733552,2025-02-26 10:10:07,"the storm prediction center issues day 7 15 any severe convective risk at feb 26 954z for portions of lch
at wed 26 feb 2025 095600 0000 via iembot
additional details here",storm,None,,https://bsky.app/profile/lch.nws-bot.us/post/3lj355iolul2i,-0.5719
2745733522,2025-02-26 10:08:24,"the storm prediction center issues day 7 15 any severe convective risk at feb 26 954z for portions of bmx
at wed 26 feb 2025 095600 0000 via iembot
additional details here",storm,None,,https://bsky.app/profile/bhm.nws-bot.us/post/3lj352kbyyl2e,-0.5719
6343342,2025-02-26 10:07:52,"the storm prediction center issues day 7 15 any severe convective risk at feb 26 954z for portions of lix
at wed 26 feb 2025 095601 0000 via iembot
additional details here",storm,None,,https://bsky.app/profile/msy.nws-bot.us/post/3lj34zlhiea2f,-0.5719
7643342,2025-02-26 10:04:11,"the storm prediction center issues day 7 15 any severe convective risk at feb 26 954z for portions of tsa
at wed 26 feb 2025 095600 0000 via iembot
additional details here",storm,None,,https://bsky.app/profile/tsa.nws-bot.us/post/3lj34syxpiw2d,-0.5719
252453342,2025-02-26 10:03:25,"the storm prediction center issues day 7 15 any severe convective risk at feb 26 954z for portions of shv
at wed 26 feb 2025 095600 0000 via iembot
additional details here",storm,None,,https://bsky.app/profile/shv.nws-bot.us/post/3lj34rlprkb2x,-0.5719
27675334425,2025-02-26 10:01:20,"the storm prediction center issues day 7 15 any severe convective risk at feb 26 954z for portions of jan
at wed 26 feb 2025 095600 0000 via iembot
additional details here",storm,None,,https://bsky.app/profile/jan.nws-bot.us/post/3lj34nuxl4b25,-0.5719
75233452,2025-02-26 09:58:50,"the storm prediction center issues day 7 15 any severe convective risk at feb 26 954z for portions of fwd
at wed 26 feb 2025 095601 0000 via iembot
additional details here",storm,None,,https://bsky.app/profile/fwd.nws-bot.us/post/3lj34jfz5ba2z,-0.5719
773653633442,2025-02-26 09:56:03,the storm prediction center issues days 48 convective outlook max risk 15 any severe at feb 26 954z link,storm,None,,https://bsky.app/profile/spc.weather.im/post/3lj34efs4kb2k,-0.5719
6652534642,2025-02-26 20:06:51,a snowblower i ordered got stuck in a pile at the local amazon warehouse for about a week all thanks to get this a snowstorm great timing,"storm, snowstorm",None,,https://bsky.app/profile/wombat-ee.bsky.social/post/3lj46in4olc2d,0.7717
7327346522,2025-02-26 20:02:50,not long ago i drove through a snowstorm while none inch nails ambient song hopw we can again played and it was an experience i cant explain in a good way i still havent recovered,"storm, snowstorm",recover,,https://bsky.app/profile/obeydontstray.bsky.social/post/3lj46bh52rc2e,0.6486
4735334345742,2025-02-26 19:55:06,"we were supposed to get a snowstorm last wednesday but it didnt happen so it made it funny to see the lines of the saline treatment still on the roads when i drove to the comic shop today
especially given that its currently 71 out","storm, snowstorm",None,,https://bsky.app/profile/jonpaulmaki.com/post/3lj45tln74k2h,0.5927
52353432,2025-02-26 19:21:59,"breaking news

condo passed termite inspection
the man in the blue hat said no varmints found in the entire condo community so far 

my theory is that a lot of varmints died during that freak florida snowstorm last month i know it was a close encounter for me too","storm, snowstorm",None,,https://bsky.app/profile/unicornherder.bsky.social/post/3lj43ygfxzs2f,-0.8271
46734223,2025-02-26 19:02:04,"my blue recycling bin didnt get emptied last week the street crew was busy with the snowstorm thankfully its warmer this week the snow is gone

hopefully the water main replacement project will be finished soon we just got connected to the new main todaypotable_water","storm, snowstorm",None,#visualjournal #madewithpaper,https://bsky.app/profile/slowpilgrim.bsky.social/post/3lj42upcbas23,0.7424
3634262,2025-02-26 18:49:50,start stocking up like for a snowstorm but including online shoppingmake sure you have gas and groceries and dont make plans that have to do with spending money except cash purchases from small businesses shouldnt be too hard,"storm, snowstorm",None,,https://bsky.app/profile/maximalistvegan.bsky.social/post/3lj426uuhvc2k,0.6636
4332,2025-02-26 18:35:50,in the middle of a snowstorm i found my peace snowflake,"storm, snowstorm",None,,https://bsky.app/profile/trinashedx.bsky.social/post/3lj3zfqyxkc2p,0.5423
767247333352,2025-02-26 18:33:12,high park snowstorm,"storm, snowstorm",None,#photography #winter #snow #toronto,https://bsky.app/profile/joanosullivanphoto.bsky.social/post/3lj3zf3rs5k2b,0.0
3243332,2025-02-26 18:04:56,theres something magical about spotting a flash of red against a winter whiteout bird red_heart  these cardinals braved the snowstorm in prince edward county and its always a treat to capture them in flight,"storm, snowstorm",None,#birding #cardinal #wildlife #wildlifelovers,https://bsky.app/profile/fo-outdoors.bsky.social/post/3lj3xom3pcb2b,0.6808
272352334432,2025-02-26 17:55:10,"i love harmless pettiness major connecticut snowstorm allows antimaga neighbors to revel  

original post on wegotthiscoveredcom","storm, snowstorm",None,,https://bsky.app/profile/TikTok.activitypub.awakari.com.ap.brid.gy/post/3lj3x4sm4ar32,0.8176
2733222,2025-02-26 17:42:15,a month or so ago after a major snowstorm someone whined about the bike lane being inaccessible and i was stunned at the audacity of this guy meanwhile parents at my kids school had to fight to make visart street accessible after storms it was a priority 4 street instead of 1 its now 2,"storm, snowstorm",None,,https://bsky.app/profile/thespiritof72.bsky.social/post/3lj3wg2gz2c2x,-0.6326
23233452,2025-02-26 16:47:28,"620727 is quite the concert stretch

3 phish in manchvegas 
dmb  meadowbrook
khruangbin  suffolk downs
lumineers  fenway
coldplay  gillette 
rufus du sol  greatwoods

need another snowstorm to pad the bank account a tad","storm, snowstorm",None,,https://bsky.app/profile/mikebruce12.bsky.social/post/3lj3te4p5xs2p,0.0
76423633262,2025-02-26 16:05:21,delivering the dick after a snowstorm not all heroes wear capes,"storm, snowstorm",None,,https://bsky.app/profile/jojojomo.bsky.social/post/3lj3qypq26k2x,-0.7186
2233227,2025-02-26 15:54:08,mid90s you and i missed it and i had a raging case of the chicken pox to show for it i remember sitting in my moms car in a snowstorm waiting for everyone to leave the doctors office before he let us in excellent infection control from a local doc in the late 70s,"storm, snowstorm",None,,https://bsky.app/profile/elizabethjacobs.bsky.social/post/3lj3qeqvly227,-0.2732
453372,2025-02-26 15:22:46,your photos of februarys historic lake effect snowstorm snowflake,"storm, snowstorm",None,,https://bsky.app/profile/ursentinel.bsky.social/post/3lj3omgfm7k2f,0.0
3733557332,2025-02-26 14:59:45,snowstorm in louisville ky  2025,"storm, snowstorm",None,#photo #photography #film #filmphotography #35mm #pentax #kodak #streetphotography,https://bsky.app/profile/junedogart.bsky.social/post/3lj3ndbzijs2t,0.0
6575332,2025-02-26 14:47:22,i remember we had a snowstorm blow through on the day of this painting,"storm, snowstorm",None,#sketchbook #birbfest #gouache,https://bsky.app/profile/khanningsart.bsky.social/post/3lj3mndbsrk2k,0.0
6326333222,2025-02-26 14:42:11,"good morning brendaheart_exclamation 
happy wednesday aka hump day camel twohump_camel  im excited we are halfway to the weekend   your picture reminded me of a tropical graphic that i made during a snowstorm  hopefully those days are over for the season  have a wonderful day my friend  ttyl  two_hearts 
hot_beverage teapot bubble_tea sun twohump_camel butterfly blue_heart sparkles dizzy","storm, snowstorm",None,,https://bsky.app/profile/lexit27.bsky.social/post/3lj3mdyg22c2z,0.9868
7234334524,2025-02-26 14:37:45,"spectral bottled snowstorm has been found by facundoxd365 master
base rarity 67200000
blocks mined 229515736
pickaxe prism of chaos","storm, snowstorm",None,,https://bsky.app/profile/rexfinds.bsky.social/post/3lj3m45xkau24,-0.6808
