tweet_id,timestamp,tweet_text,matched_disaster_keywords,matched_crisis_keywords,hashtags,post_url,sentiment_score,images
343223,2025-03-20 22:35:29,"drove home in a thunderstorm and cannot stop intrusive thoughts about daddy zeus

luke holt and epicthe musical animatic artists have permanently altered me in ways i am only beginning to comprehend","storm, thunderstorm",None,,https://bsky.app/profile/mommy-cass.bsky.social/post/3lktr2mbbrk23,0.2235,[]
7643232,2025-03-20 22:34:32,i was referring to the thunderstorm,"storm, thunderstorm",None,,https://bsky.app/profile/goldstein.bsky.social/post/3lktqyyhhxs2d,0.0,[]
42353753622,2025-03-20 22:33:06,there is the best thunderstorm happening right now,"storm, thunderstorm",None,#baltimorecity,https://bsky.app/profile/dataangel.space/post/3lktqwf6lm22b,0.6369,[]
4363223,2025-03-20 22:31:12,every time a thunderstorm rolls in i think of this specific clip,"storm, thunderstorm",None,,https://bsky.app/profile/socalaquarius35.bsky.social/post/3lktqsyqin223,0.0,[]
63672,2025-03-20 22:27:16,well that was a neat little thunderstorm,"storm, thunderstorm",None,,https://bsky.app/profile/josephsreed.bsky.social/post/3lktqlyn67k2o,0.6249,[]
2637232,2025-03-20 22:26:27,sitting on my bed in the quiet mostlydark looking out at a city winding down as a thunderstorm pours down while im safe and warm inside a pleasure i went 10 years without and which is soothing me right now,"storm, thunderstorm",None,,https://bsky.app/profile/foxharper.bsky.social/post/3lktqkivgjc2q,0.8689,[]
57563232,2025-03-20 22:24:47,in other news were enjoying a nice little thunderstorm here and im snuggled up in a blanket happy thursday yall,"storm, thunderstorm",None,,https://bsky.app/profile/notarizona.bsky.social/post/3lktqhjpcwk2b,0.872,[]
3446332,2025-03-20 22:30:16,northwest iowa power cooperative is calling this the most damage from a severe winter storm since the halloween blizzard of 1991,"blizzard, storm",damage,,https://bsky.app/profile/ktiv.com/post/3lktqrdnvsu2k,-0.7264,[]
3626322,2025-03-20 21:38:30,our hero earl reagan has had enough of the controller and decides to take over but hes left it a bit late theres a definite sense that the humans are about to get a severe talkingto from the dinosaurs  and actual tension as the final attack kicks off,None,attack,,https://bsky.app/profile/ianlovescomix.bsky.social/post/3lktnuojxz22u,-0.7615,"[{""url"": ""https://bsky.social/xrpc/com.atproto.sync.getBlob?did=did:plc:qg3syf6qqgyux2h6lybvcaqn&cid=bafkreias5a5kjjjrdwmgnntpqbp2hemdlka2uuyethr5zpffwv2cri3r5u"", ""local_path"": ""/images/3626322_0.jpg"", ""alt"": ""Page from 2000AD Prog 14, featuring Flesh. A lightning storm breaks out, and Earl Reagan recognises this as being bad news. Sure enough, the prehistoric fauna go nuts, with pteranadons, dinosaurs, and giant spiders all attacking at once, while the Tyrannosaur, Old One-Eye gets ready to win.""}]"
42767453762,2025-03-20 20:50:42,a severe storm system brought tornadoes and strong winds to droughtstricken areas from texas to kansas kicking up dust storms and wildfires the combined impact has now become one of the deadliest weather disasters in decades in the us com,"wildfire, drought, tornado, storm, severe storm, dust storm","dead, fire",,https://bsky.app/profile/safe-climate.bsky.social/post/3lktl76thns2u,-0.4404,[]
26432536526,2025-03-20 20:50:06,"at least 40 people were killed amid more than 970 severe storm reports across more than two dozen states over the weekend a threeday tornado outbreak tore through at least nine states
not a word about that from trump","tornado, storm, severe storm",killed,,https://bsky.app/profile/riotgrrrlrevolt.bsky.social/post/3lktl65vwrc26,-0.8107,[]
666242362,2025-03-20 20:20:04,"spc mar 20 2025 2000 utc day 1 convective outlook
no severe thunderstorm areas forecast
additional details here","storm, thunderstorm",None,,https://bsky.app/profile/spc-storms.nws-bot.us/post/3lktjijpyo62j,-0.3818,"[{""url"": ""https://bsky.social/xrpc/com.atproto.sync.getBlob?did=did:plc:tzoxs6ii6u6p24bjzz2kozxn&cid=bafkreiaienw6oqpckwtvryyo5bv645tmi5qkx64ufb6ghcjq6od6osw4xu"", ""local_path"": ""/images/666242362_0.jpg"", ""alt"": ""\nDay 1 Convective Outlook  \nNWS Storm Prediction Center Norman OK\n0256 PM CDT Thu Mar 20 2025\n\nValid 202000Z - 211200Z\n\n...NO SEVERE THUNDERSTORM AREAS FORECAST...\n\n...SUMMARY...\nIsolated thunderstorms are possible today in parts of the\nMid-Atlantic and northern Rockies. Severe weather is not expected.\n\n...20Z Update...\nThe previous forecast reasoning (see below) remains the same, and no\nchanges were made with this update. A swath of showers with\nisolated/embedded lightning is tracking east-northeastward across\nthe Mid-Atlantic ahead of the front this afternoon. A few strong\ngusts (40-50 mph) may accompany this activity as it overspreads\nportions of northeastern NC and southeastern VA -- where continued\ndiurnal heating and steepening low-level lapse rates will aid in\ndownward momentum transport. However, the overall risk of severe\nwind gusts still appears too low for probabilities at this time.\n\n..Weinman.. 03/20/2025\n\n.PREV DISCUSSION... /ISSUED 1110 AM CDT Thu Mar 20 2025/\n\n...Eastern NC/Southeast VA...\n\nStrong heating ahead of an eastward-developing surface front will\nallow temperatures to continue climbing into the 70s F this\nafternoon. Boundary layer moisture is expected to remain modest,\nwith surface dewpoints generally reaching the mid/upper 50s F in a\nnarrow corridor just as the surface front arrives. Morning balloon\nobservations from GSO, RNK, IAD, and WAL show very dry midlevels as\nwell. While some midlevel moistening will occur as strong midlevel\nsouthwesterlies overspread the region, overall airmass modification\nwill remain poor. MLCAPE values are expected to remain stunted,\ngenerally less than 100-200 J/kg. This may be sufficient for a few\nlightning flashes as convection develops during the mid afternoon\nalong the surface front. A well-mixed boundary layer to near 850 mb,\nwhere 25-40 kt of flow is forecast, is evident in forecast\nsoundings. This may support a few strong gusts to 40 kt, but very\npoor thermodynamic profiles suggest potential for severe\nthunderstorms should remain low, precluding severe probabilities.\n\n""}, {""url"": ""https://bsky.social/xrpc/com.atproto.sync.getBlob?did=did:plc:tzoxs6ii6u6p24bjzz2kozxn&cid=bafkreib4fec57ww25s6pr5isxqwlpahfv3soko7fh223ioytc6rmnslotu"", ""local_path"": ""/images/666242362_1.jpg"", ""alt"": ""Day 1 Outlook Image""}]"
4335362422,2025-03-20 19:49:07,not much is better than watching a severe storm roll in over the lakes,"storm, severe storm",None,,https://bsky.app/profile/feraljoe.bsky.social/post/3lkthr62t422m,-0.6131,[]
66673422,2025-03-20 19:41:17,"when chicagos weather cant make up its mind  earthcam captured it all a dust storm severe thunderstorm sunset rainbow and snow  all in 24 hours

just another day in the windy city","storm, thunderstorm, dust storm",None,,https://bsky.app/profile/accuweather.com/post/3lkthd4esn22w,-0.4912,[]
6522362,2025-03-20 19:22:58,"icymi share of the final part of my technical summary of the march 1416 event including discussion of how the event was forecast and severe storm forecast verification

opensubstackcompubbalanced","storm, severe storm",None,,https://bsky.app/profile/wxmanms1.bsky.social/post/3lktgcg6wnc2n,-0.1027,[]
6662423542,2025-03-20 19:20:05,"spc mar 20 2025 1930 utc day 3 severe thunderstorm outlook
there is a marginal risk of severe thunderstorms in parts of
mo
additional details here","storm, thunderstorm",None,,https://bsky.app/profile/spc-storms.nws-bot.us/post/3lktg5b4fhi2q,-0.695,"[{""url"": ""https://bsky.social/xrpc/com.atproto.sync.getBlob?did=did:plc:tzoxs6ii6u6p24bjzz2kozxn&cid=bafkreialpk4yfy3reckefehkdrvirv3bu5wwkrvf24df5l3vzvca4aov54"", ""local_path"": ""/images/6662423542_0.jpg"", ""alt"": ""\nDay 3 Convective Outlook  \nNWS Storm Prediction Center Norman OK\n0211 PM CDT Thu Mar 20 2025\n\nValid 221200Z - 231200Z\n\n...THERE IS A MARGINAL RISK OF SEVERE THUNDERSTORMS IN PARTS OF\nMO...EASTERN OK/KS...AND NORTHWEST AR...\n\n...SUMMARY...\nIsolated severe thunderstorms, mainly from large hail, are possible\non Saturday night in/near the Ozark Plateau.\n\n...MO/OK/KS/AR...\nNo change to the prior outlook of level 1-MRGL risk. Elevated severe\nhail remains possible Saturday evening into the overnight, with\npotential for a mesoscale area of level 2-SLGT in a future outlook.\n\nThe next in a series of shortwave troughs progressing from the\nnorthern Rockies into the North-Central States will yield modified\nmoisture recovery from the western Gulf, beneath an increasingly\nexpansive/stout EML. The degree of moistening depicted in some\nmodels is questionable owing to predominately 20s/30s surface dew\npoints at present along the TX Gulf Coast. Elevated buoyancy will\nlikely remain weak with MUCAPE at/below 1000 J/kg. But strengthening\nforcing for ascent should support elevated thunderstorms as early as\nSaturday evening across the Ozark Plateau, increasing in coverage\nduring the night. \n\nWithin a predominately westerly mid to upper wind profile, given the\ngeometry of the northern Great Plains shortwave trough, favorable\nspeed shear should exist for at least a few elevated supercells. The\npotentially limited buoyancy and perhaps a more widespread\ncluster-type convective mode may modulate the overall\ncoverage/intensity of the large hail threat. The southern extent of\nconvective development may have a sharp cutoff beyond the Ozarks\ngiven the expected strength of the EML and neutral mid-level height\nchange through 12Z Sunday.\n\n..Grams.. 03/20/2025\n\n""}, {""url"": ""https://bsky.social/xrpc/com.atproto.sync.getBlob?did=did:plc:tzoxs6ii6u6p24bjzz2kozxn&cid=bafkreicechtzfbm3m6sjffycnfdaxn2bs7wvwpcjajh3sb3yki6n66yogq"", ""local_path"": ""/images/6662423542_1.jpg"", ""alt"": ""Day 3 Outlook Image""}]"
43443432,2025-03-20 19:19:36,a powerful storm system brought 17 tornado warnings egg sized hail and 75 mph winds across the midwest yesterday  that same storm is weakening as it moves east today expect 12 of rain and nonsevere storms with a couple inches of snow across the northeast bskysocial,"tornado, storm, severe storm",warning,,https://bsky.app/profile/zoemintz.bsky.social/post/3lktg4c3rxc2c,-0.1027,[]
4654332,2025-03-20 19:07:21,a2 when hiking the loop trail down from granite park chalet last summer i encountered two trail maintenance staff with chainsaws several miles in clearing logs that had fallen during a severe storm wed had at the park recently,"storm, severe storm",fallen,,https://bsky.app/profile/expeditions-evelyn.bsky.social/post/3lktfgilzjs2x,-0.6249,[]
2756332,2025-03-20 18:10:09,"severe storm supercell and tornado trends

as the climate continues to warm the number of days conducive to severe weather is projected to increase

learn more share the trends","tornado, storm, severe storm",None,,https://bsky.app/profile/climatecentral.org/post/3lktca3yhjs2z,0.5256,[]
522532,2025-03-20 18:02:00,violent tornadoes ripped through parts of the us wiping out schools and toppling semitractortrailers in several states part of a monster storm that killed at least 35 people as more severe weather was expected,"tornado, storm",killed,,https://bsky.app/profile/thaantichrist2027.bsky.social/post/3lktbrkfiwk2o,-0.9061,"[{""url"": ""https://bsky.social/xrpc/com.atproto.sync.getBlob?did=did:plc:z5unxm2brmrelsh2dd5lgchn&cid=bafkreihwvsx4h5vbuohtxdj3wjwtvgnvedv6xpicyvesrc4qlq6d7h3r6i"", ""local_path"": ""/images/522532_0.jpg"", ""alt"": """"}]"
36242732,2025-03-20 18:00:52,when we mention a marginal slight or enhanced risk for severe weather were referring to severe thunderstorm risk categories used by the nws storm prediction center spc in their outlooks these categories are based on expected coverage and intensity of potential severe thunderstorms,"storm, thunderstorm",None,,https://bsky.app/profile/southmiwx.com/post/3lktbpjtqlw2j,-0.8669,"[{""url"": ""https://bsky.social/xrpc/com.atproto.sync.getBlob?did=did:plc:owa3ag6c2co42e7pwjgirsgv&cid=bafkreiecvk6n2wteiobfkcrhxorfvvvtquvp63zqdtgei2f4ywnwf65sum"", ""local_path"": ""/images/36242732_0.jpg"", ""alt"": """"}]"
5446433442,2025-03-20 17:45:25,"fitzroy
gale warning southerly storm force 10 decreasing severe gale force 9 imminent then gale force 8 soon then veering northwesterly and increasing severe gale force 9 later
issued at 1551 utc on thu 20 mar 2025",storm,"imminent, warning",,https://bsky.app/profile/shipforecastbot.bsky.social/post/3lktatz4ag42f,-0.765,[]
54464332,2025-03-20 17:45:25,"1931 fitzroy
wind cyclonic gale 8 to storm 10 decreasing 6 to gale 8 occasionally severe gale 9 later in west
sea state rough or very rough occasionally high
weather rain or thundery showers
visibility moderate or good occasionally poor",storm,None,,https://bsky.app/profile/shipforecastbot.bsky.social/post/3lktatyjohi2i,-0.2991,[]
35552753727,2025-03-20 17:20:45,just finished the official nws  skywarn storm spotter training now i can call in severe weather and help out with weather awareness d,storm,None,,https://bsky.app/profile/nikkinarratesbooks.bsky.social/post/3lkt7hsmpqs27,0.5707,"[{""url"": ""https://bsky.social/xrpc/com.atproto.sync.getBlob?did=did:plc:y35jvwtbcuv5ivxou5o2u7n5&cid=bafkreigqt7f5rvy4lvgy7xvwyvah6bosdaagp5avixyeehkibgijhytfmi"", ""local_path"": ""/images/35552753727_0.jpg"", ""alt"": """"}]"
6662423752,2025-03-20 17:20:04,"spc mar 20 2025 1730 utc day 2 convective outlook
no severe thunderstorm areas forecast
additional details here","storm, thunderstorm",None,,https://bsky.app/profile/spc-storms.nws-bot.us/post/3lkt7gnu5bm2b,-0.3818,"[{""url"": ""https://bsky.social/xrpc/com.atproto.sync.getBlob?did=did:plc:tzoxs6ii6u6p24bjzz2kozxn&cid=bafkreibgmoqx2zis56o63hmkrvioqpvek55akljjarnqobkz7elkkqc6km"", ""local_path"": ""/images/6662423752_0.jpg"", ""alt"": ""\nDay 2 Convective Outlook  \nNWS Storm Prediction Center Norman OK\n1159 AM CDT Thu Mar 20 2025\n\nValid 211200Z - 221200Z\n\n...NO SEVERE THUNDERSTORM AREAS FORECAST...\n\n...SUMMARY...\nSevere thunderstorms are not expected Friday.\n\n...Mid-MO/MS Valleys...\nA compact shortwave impulse currently over the northern Rockies will\nprogress across parts of the Mid-MO/MS Valleys Friday. Despite a\ndearth of low-level moisture, diurnally steepening lapse rates along\nwith a focused corridor of moderate large-scale ascent should\nsupport a swath of isolated to scattered low-topped convection,\nprimarily from late morning to early evening. Meager buoyancy should\nbe adequate for sporadic lightning. Gusty, sub-severe winds may\naccompany this activity, especially across the southern portion of\nthe convective threat, owing to a deeper mixed boundary layer and\n30-40 kt 850-mb westerlies. \n\n...Northwest...\nThe next shortwave trough will move inland of the Pacific Northwest\ncoast and reach the northern Rockies by Friday night. Scattered\nlow-topped convection should accompany this wave within a confined\nbelt of stronger forcing for ascent coincident with scant buoyancy\nat most. Isolated thunderstorms are possible near the Cascades on\nFriday afternoon, shifting east across the Columbia Basin and into\nthe northern Rockies through late evening.\n\n..Grams.. 03/20/2025\n\n""}, {""url"": ""https://bsky.social/xrpc/com.atproto.sync.getBlob?did=did:plc:tzoxs6ii6u6p24bjzz2kozxn&cid=bafkreialcknoeaeh3whur2jxbb3d7rkgo6c4hmhx2cropwqqrkq4sp65mq"", ""local_path"": ""/images/6662423752_1.jpg"", ""alt"": ""Day 2 Outlook Image""}]"
463643636252,2025-03-20 16:59:08,martinho football stadium suffers severe damage as storm martinho rattles portugal,storm,damage,,https://bsky.app/profile/esn.ebu.ch/post/3lkt6ba2a5w2v,-0.743,[]
2336535422,2025-03-20 16:49:57,"the radar is a podcast hosted by storm team 21 that will discuss all things weather it is severe weather awareness week in ohio and chief meteorologist bskysocial talked with storm chaser tyler berry in the debut episode  

the podcast is available wherever you get your podcasts",storm,None,,https://bsky.app/profile/21wfmj.bsky.social/post/3lkt5qris422q,-0.3818,[]
4235422,2025-03-20 16:46:17,"we have awarded solidarity grants to the northern illinois and oklahoma annual conferences to assist their response efforts to the devastating monster storm system last weekend 

we encourage you to continue to pray for all those impacted by this severe weather event",storm,"devastating, impacted",#beumc,https://bsky.app/profile/umcor.bsky.social/post/3lkt5k4rvs22w,0.4767,"[{""url"": ""https://bsky.social/xrpc/com.atproto.sync.getBlob?did=did:plc:iqvprrg4egituhcl2eeimxjl&cid=bafkreiceawuoxlgtv475veu63rorccjqic6tz4c5yn4cyygbyeskstkg6a"", ""local_path"": ""/images/4235422_0.jpg"", ""alt"": """"}]"
573525356622,2025-03-20 16:39:49,"100 confirmed tornadoes from the march 1416 us severe weather outbreak a significant event

but

those who think tornadoes are the predominant driver of annual us severe convective storm scs losses are mistaken in any given year hail accounts for 5080 of scs insurance claims","tornado, storm",None,,https://bsky.app/profile/stevebowen.bsky.social/post/3lkt56lj6zk22,-0.8793,"[{""url"": ""https://bsky.social/xrpc/com.atproto.sync.getBlob?did=did:plc:eeicf57cwhd352bstl5gtiuo&cid=bafkreih7y27xlwdnu4kmkjrtol5c3hgp5jwhh2wgf7pazbh4ib5nvocoj4"", ""local_path"": ""/images/573525356622_0.jpg"", ""alt"": """"}]"
666242343572,2025-03-20 16:20:05,"spc mar 20 2025 1630 utc day 1 convective outlook
no severe thunderstorm areas forecast
additional details here","storm, thunderstorm",None,,https://bsky.app/profile/spc-storms.nws-bot.us/post/3lkt43ey5x72r,-0.3818,"[{""url"": ""https://bsky.social/xrpc/com.atproto.sync.getBlob?did=did:plc:tzoxs6ii6u6p24bjzz2kozxn&cid=bafkreiabjd2b7kpbmanxf77emn7pkhpbt6y6psa76shjxbdy6lukzjfxom"", ""local_path"": ""/images/666242343572_0.jpg"", ""alt"": ""\nDay 1 Convective Outlook  \nNWS Storm Prediction Center Norman OK\n1110 AM CDT Thu Mar 20 2025\n\nValid 201630Z - 211200Z\n\n...NO SEVERE THUNDERSTORM AREAS FORECAST...\n\n...SUMMARY...\nThunderstorm development will be possible today in parts of the\nMid-Atlantic and northern Rockies. Severe weather is not expected.\n\n...Eastern NC/Southeast VA...\n\nStrong heating ahead of an eastward-developing surface front will\nallow temperatures to continue climbing into the 70s F this\nafternoon. Boundary layer moisture is expected to remain modest,\nwith surface dewpoints generally reaching the mid/upper 50s F in a\nnarrow corridor just as the surface front arrives. Morning balloon\nobservations from GSO, RNK, IAD, and WAL show very dry midlevels as\nwell. While some midlevel moistening will occur as strong midlevel\nsouthwesterlies overspread the region, overall airmass modification\nwill remain poor. MLCAPE values are expected to remain stunted,\ngenerally less than 100-200 J/kg. This may be sufficient for a few\nlightning flashes as convection develops during the mid afternoon\nalong the surface front. A well-mixed boundary layer to near 850 mb,\nwhere 25-40 kt of flow is forecast, is evident in forecast\nsoundings. This may support a few strong gusts to 40 kt, but very\npoor thermodynamic profiles suggest potential for severe\nthunderstorms should remain low, precluding severe probabilities.\n\n..Leitman/Squitieri.. 03/20/2025\n\n""}, {""url"": ""https://bsky.social/xrpc/com.atproto.sync.getBlob?did=did:plc:tzoxs6ii6u6p24bjzz2kozxn&cid=bafkreictcrchy5ktrgjzk2s6i5n33d7wknisqbfuwk4c2e3inpdfpzmzhm"", ""local_path"": ""/images/666242343572_1.jpg"", ""alt"": ""Day 1 Outlook Image""}]"
657273463332,2025-03-20 16:07:08,while much of last nights thundershower activity lost steam as it raced east we still saw some gusts past 50 mph in a few spots port clinton barely made the cut as a severe storm at 58 mph,"storm, severe storm",None,,https://bsky.app/profile/dansmithweather.bsky.social/post/3lkt3dzm3ac2k,-0.6943,"[{""url"": ""https://bsky.social/xrpc/com.atproto.sync.getBlob?did=did:plc:657kftv2m7vu3q46guqltamn&cid=bafkreidjvj2i6txewrdei77ph32qjmhj5sday3pen72qfn4pgnqszf62si"", ""local_path"": ""/images/657273463332_0.jpg"", ""alt"": ""Peak winds near 60 mph in some towns/cities in NW Ohio last night.""}]"
6543552,2025-03-20 23:12:43,thursday morning snowstorm in oak park illinois,"storm, snowstorm",None,#photography #photo #photographer #reflection #streetphotography,https://bsky.app/profile/pauljreis.bsky.social/post/3lktt55iezc2a,0.0,"[{""url"": ""https://bsky.social/xrpc/com.atproto.sync.getBlob?did=did:plc:xtrlkr6rhsew5qtyuydtuuj4&cid=bafkreiblpx5cfulimyoyetfcmoehtnrcgfd5uivfk6e4tzmydi724wo5vy"", ""local_path"": ""/images/6543552_0.jpg"", ""alt"": """"}, {""url"": ""https://bsky.social/xrpc/com.atproto.sync.getBlob?did=did:plc:xtrlkr6rhsew5qtyuydtuuj4&cid=bafkreiaya7pw5qcgvmmxuk7iqa4lyrdo6i2jzd4xpnhb3mhf5fhfayih5e"", ""local_path"": ""/images/6543552_1.jpg"", ""alt"": """"}]"
7234327,2025-03-20 23:10:51,"spectral bottled snowstorm has been found by superkilllor master
base rarity 67200000
blocks mined 140775498
pickaxe prism of chaos","storm, snowstorm",None,,https://bsky.app/profile/rexfinds.bsky.social/post/3lktszvyhfg27,-0.6808,[]
3563323,2025-03-20 23:00:39,this was judith getting cozy just a few months after i brought her inside after i found her hiding under some stairs from a snowstorm in the spring of 2020 i had a lot of time on my hands and her as my only company thats a large part of how i got into cat training,"storm, snowstorm",None,#catsofbluesky,https://bsky.app/profile/catsoftamarack.bsky.social/post/3lktshlasbs23,-0.296,"[{""url"": ""https://bsky.social/xrpc/com.atproto.sync.getBlob?did=did:plc:ryktbf35bnicnnn6tn3lzuho&cid=bafkreif2lnui7kd3lh6jnn2a7ej33iqqnbh7tg6gkziipiigp7leqve2b4"", ""local_path"": ""/images/3563323_0.jpg"", ""alt"": ""A brown and black tabby lies on a bed with a blanket covering her lower half, her eyes barely open. ""}]"
367732,2025-03-20 22:40:34,we picked up groceries today and the stores were so busy i had to ask if theres a snowstorm or a holiday tomorrow,"storm, snowstorm",None,,https://bsky.app/profile/terriclarke.bsky.social/post/3lktrdqtohc2z,0.4019,[]
3673223,2025-03-20 22:32:47,"left work and theres a snowstorm
it was supposed to be warm

im spoiling myself tonight
maybe ill buy a game","storm, snowstorm",None,,https://bsky.app/profile/linkski.bsky.social/post/3lktqvtyzo223,0.2263,[]
436522,2025-03-20 21:35:22,super cute but gurl you know were not safe until may  always one last snowstorm in april here at least,"storm, snowstorm",None,,https://bsky.app/profile/thagingerhasasoul.bsky.social/post/3lktnp65kw22l,0.634,[]
22534322,2025-03-20 21:22:02,great crowd all night honestly  the show needed to be amazing as a reward for all of those people who braved the snowstorm and it did exactly that,"storm, snowstorm",None,,https://bsky.app/profile/cgd-2.bsky.social/post/3lktmxcuw2c2c,0.9552,[]
446332336422,2025-03-20 21:03:55,me when my buddy is caught in a snowstorm,"storm, snowstorm",None,,https://bsky.app/profile/hazardguy.bsky.social/post/3lktlwx64pk22,0.0,[]
262254322,2025-03-20 20:53:22,"its a truck thats not a very good truck a 4x4 that cant go offroad cant handle a snowstorm is blinded by snow cant hold on to its body panels and has burned three teenagers to death trapped in it 

its also among the most quickly totaled vehicles on the road

great design elon","storm, snowstorm","body, burn, death",,https://bsky.app/profile/thinkermb.bsky.social/post/3lktle2sbpk2l,-0.7282,[]
23437422,2025-03-20 20:50:45,"obrigada a gente foi na moa de quebec que vende poutine aqui e ela tava falando que ia ter snowstorm e eu fiquei morrendo de medo

a gente agora precisa achar um lugar pra comer quando a gente chegar o olive et gourmando j vai ter fechado","storm, snowstorm",None,,https://bsky.app/profile/ttzera.bsky.social/post/3lktl7fbw422k,-0.5696,[]
33533722,2025-03-20 20:30:32,hoa k news 9 2032025,"tornado, storm, snowstorm",None,#tintuc #tinbuoisang #unv #news #nguoiviet #tinhoaky #andynguyen #unvtinbuoisang #tintuctiengviet #vietnamese #tornado #weather #texas #locxoay #snowstorm #winterstorm,https://bsky.app/profile/unvtinbuoisang.bsky.social/post/3lktk37ryr22f,0.0,[]
2346323227,2025-03-20 20:07:27,three women are missing after a snowstorm and 22vehicle crash in northern arizona last week,"storm, snowstorm","crash, missing",,https://bsky.app/profile/azcentral.com/post/3lktirwyau227,-0.5994,[]
357353752,2025-03-20 19:57:22,spring snowstorm aftermath i can live with this,"storm, snowstorm",aftermath,,https://bsky.app/profile/jobengage.bsky.social/post/3lkti7ug5ok2p,0.0,"[{""url"": ""https://bsky.social/xrpc/com.atproto.sync.getBlob?did=did:plc:f3hy57qy3pfe5zdmzlgpjuac&cid=bafkreid433smocaqr63gqdj57rqnmhebuhnndcdol6mdhhvceugxs44q2q"", ""local_path"": ""/images/357353752_0.jpg"", ""alt"": ""A lake with open water and fresh snow.""}]"
36457434622,2025-03-20 19:41:47,were entering autumm but still gettin sunblasted here please send that snowstorm to us,"storm, snowstorm",blast,,https://bsky.app/profile/patacon.bsky.social/post/3lkthe46yo22c,0.4497,[]
344723322,2025-03-20 19:35:16,happy spring there was a huge snowstorm last night,"storm, snowstorm",None,,https://bsky.app/profile/cherrypopsycat.bsky.social/post/3lktgyfwsf22x,0.7184,[]
6363372,2025-03-20 18:54:20,snowstorm in the valley xii aowsco,"storm, snowstorm",None,,https://bsky.app/profile/feediverse.bsky.social/post/3lktep7uakn2c,0.0,[]
22565323,2025-03-20 18:50:50,we tend to get a least one snowstorm after the beginning of march but not blizzards i dont remember ever being in a blizzard after stpatricks day,"blizzard, storm, snowstorm",None,,https://bsky.app/profile/efino87.bsky.social/post/3lkteixhajk23,0.0,[]
