tweet_id,timestamp,tweet_text,matched_disaster_keywords,matched_crisis_keywords,hashtags,post_url,sentiment_score
46626233225,2025-02-26 17:29:59,from my time working for the forest service and my husbands seven years as a hir shot and three years as a fire management officer i know they never have enough help to get the job done there is always something else to do it is hard work hot work dangerous work not for lightweights,None,"danger, fire, shot",,https://bsky.app/profile/julibcr.bsky.social/post/3lj3vq2ekgs25,-0.7997
342233322,2025-02-26 17:25:09,"we hope to keep this trail open into the future although the forest service has dropped this old trail from their maps this trail originally was used to access the old fire lookout on steve peak that no longer exists
the first two photos are looking down carberry creek towards old steamboat",None,fire,,https://bsky.app/profile/applegatesiskiyou.bsky.social/post/3lj3vhda3l22u,-0.1779
57233542,2025-02-26 17:19:47,the rhode island department of environmental managements dem forest fire program is offering an entry level course to train participants in the tools tactics and strategies used to suppress uncontrolled wildland fires full details at,forest fire,fire,,https://bsky.app/profile/northatlfiresci.bsky.social/post/3lj3v5v4rze2g,-0.5267
7233363332,2025-02-26 17:17:00,cal fires masticators clear brush and small trees reducing wildfire fuel and creating vital fire breaks these machines slow fire spread aid evacuations and improve firefighter accessprotecting communities yearround,wildfire,"evacu, fire",#wildfireprevention #calfire,https://bsky.app/profile/calfire.bsky.social/post/3lj3uyvbljs2x,0.6249
4763362,2025-02-26 17:14:05,226202511 pm woods grass or brush fire at 3418 carmichael road ext augusta ga,brush fire,fire,,https://bsky.app/profile/auge911feed.bsky.social/post/3lj3utpwn6m2c,-0.34
4763322,2025-02-26 16:04:05,226202558 am woods grass or brush fire at 4130 woodard ave augusta ga,brush fire,fire,,https://bsky.app/profile/auge911feed.bsky.social/post/3lj3qwkb2ly2c,-0.34
476332,2025-02-26 15:58:33,226202557 am woods grass or brush fire at 4130 woodard ave augusta ga,brush fire,fire,,https://bsky.app/profile/auge911feed.bsky.social/post/3lj3qmnnbuy2o,-0.34
24333272,2025-02-26 14:30:32,9kmile 1999 ford f550 xl super duty dually 44 brush fire truck at no reserve,brush fire,fire,,https://bsky.app/profile/bringatrailer.bsky.social/post/3lj3lpae3272b,0.0772
476337223,2025-02-26 13:58:04,226202553 am woods grass or brush fire at 3418 carmichael road ext augusta ga,brush fire,fire,,https://bsky.app/profile/auge911feed.bsky.social/post/3lj3jv7j2yd23,-0.34
4763322,2025-02-26 13:43:18,226202540 am woods grass or brush fire at 3418 carmichael road ext augusta ga,brush fire,fire,,https://bsky.app/profile/auge911feed.bsky.social/post/3lj3j2sncgz2c,-0.34
27643322,2025-02-26 13:38:14,"brush or grass fire
simply mulch at 1900 veterans memorial
barren river responding",None,fire,,https://bsky.app/profile/rosphlps.bsky.social/post/3lj3irqib2r2v,-0.34
47632423,2025-02-26 06:48:04,226202544 am woods grass or brush fire at carmichael road ext and n barton dr augusta ga,brush fire,fire,,https://bsky.app/profile/auge911feed.bsky.social/post/3lj2ructan423,-0.34
47632526,2025-02-26 06:17:33,226202512 am woods grass or brush fire at carmichael road ext and n barton dr augusta ga,brush fire,fire,,https://bsky.app/profile/auge911feed.bsky.social/post/3lj2q5qcsxs26,-0.34
73326422,2025-02-26 05:59:04,smoke from a brush fire in southern california 2020,brush fire,fire,#smoke #fire #forestfire #brushfire #photography #california,https://bsky.app/profile/cloudbadger.bsky.social/post/3lj2p6l4yk22q,-0.5859
255424732422,2025-02-26 05:20:37,"it sounds really intresting i absolutely understand it some brushes are awesome but require finetuning d

i dont know if i could use this brush because im using fire alpaca se as my art program",None,fire,,https://bsky.app/profile/soraya-udw.bsky.social/post/3lj2mxv4ewc22,0.636
2764322324,2025-02-26 03:06:03,"brush or grass fire
138 mm i65 north
alvaton responding multiple callers 1 caller saying an acre was on fire and spreading avlaton requesting franklin be knocked out for the run too it is in simpson county per ksp alvaton continuing fire out at 1311",None,fire,,https://bsky.app/profile/rosphlps.bsky.social/post/3lj2fhcn2s324,-0.7351
27643226,2025-02-26 03:06:03,"missed callswcsofire 1252025
1232pm102pm
brush or grass fire
fairways at hartland apts at 850 wilkinson trace
bgfd responded for a solar panel that had caught fire in the grass",None,fire,,https://bsky.app/profile/rosphlps.bsky.social/post/3lj2fhcglot26,-0.7184
6232572,2025-02-26 00:51:48,"originally created october 14 2019

update that was made on this base was made in april 21 2022

jinx copyright  agonywolftsuki1993
 
fire brush made by rjdezigns on da

zorgoias are an open species by corriezodori",None,fire,#furryart #furry #originalcharacter #oc #watermarked #zorgoia,https://bsky.app/profile/agony-wolf.bsky.social/post/3lj25x7mnhk2c,-0.1027
5732522,2025-02-26 00:45:04,"was finishing up a story in hurricane and opening the bskysocial sutah news suv window to get a better signal when i smelled brush fire 
sure enough to the north wildfire in panguitch started around 430 and is threatening universal storage 
about four acres","hurricane, wildfire, brush fire",fire,#utahfire #fire,https://bsky.app/profile/cdreed.bsky.social/post/3lj25l2hods2p,-0.4588
476326,2025-02-25 23:41:34,225202539 pm woods grass or brush fire at 3651 wheeler rd augusta ga,brush fire,fire,,https://bsky.app/profile/auge911feed.bsky.social/post/3lizzznxhll26,-0.34
47635472,2025-02-25 21:56:07,225202552 pm woods grass or brush fire at 1438 jackson rd augusta ga,brush fire,fire,,https://bsky.app/profile/auge911feed.bsky.social/post/3lizu54g7ve2k,-0.34
476363623,2025-02-25 21:51:07,225202546 pm woods grass or brush fire at 1438 jackson rd augusta ga,brush fire,fire,,https://bsky.app/profile/auge911feed.bsky.social/post/3liztu636zi23,-0.34
735723372,2025-02-25 20:53:24,"most of these wildfire grants  many of the usfs folks laid off focused on risk reduction clearing brush creating firelines thinning trees doing prescribedcontrolled burns 

all these are ways to reduce the severity of a fire and lower the risk of it even breaking out",wildfire,"burn, fire",,https://bsky.app/profile/natsfert.bsky.social/post/3lizqmxv7jk2q,-0.2732
3253463222,2025-02-26 20:04:46,extreme heat may speed up aging in older adults research suggests  medicalxpresscomnews202502  looking at the map it appears many trump voters in the south may not make good choices due to early dementia,extreme heat,None,,https://bsky.app/profile/yknot1.bsky.social/post/3lj46f32lts22,-0.3412
724665345452,2025-02-26 19:55:56,"extreme heat may cause older people to age faster new study finds

theres also some debate among scientists about whether epigenetic clocks are the best measure for aging said rachel morellofrosch an environmental health scientist at the university of california berkeley how to best measure",extreme heat,None,,https://bsky.app/profile/musharofkhan.bsky.social/post/3lj45v4dxb52b,0.8555
37673534572,2025-02-26 19:53:16,living in extreme heat could accelerate biological ageing study,extreme heat,None,,https://bsky.app/profile/jhaue.bsky.social/post/3lj45q7hesc2q,0.0
565525345372,2025-02-26 19:41:54,extreme heat may speed up biological ageing in older people,extreme heat,None,,https://bsky.app/profile/sciences.skyfleet.blue/post/3lj453yz7ki2v,0.0
75734332,2025-02-26 19:20:14,your body could be prematurely ageing if you live in a location with as many as 190 days of extreme heat a year according to a new us study,"heatwave, extreme heat",body,#news #abc #environmental #health #science #technology #environment #heatwaves #climate #change,https://bsky.app/profile/aussienews.bsky.social/post/3lj43vb3vtu2v,0.0
253343625,2025-02-26 19:08:43,your body could be prematurely ageing if you live in a location with as many as 190 days of extreme heat a year according to a new us study,extreme heat,body,,https://bsky.app/profile/abcnewsbot.bsky.social/post/3lj43anb6fb25,0.0
3334232,2025-02-26 19:02:39,exposure to extreme heat may accelerate biological aging in older adults highlighting potential health impacts of climate change and the need for effective heat mitigation strategies doiorgg86gsb,extreme heat,None,,https://bsky.app/profile/sciencex.bsky.social/post/3lj42vsun3q2g,0.4767
756644342742,2025-02-26 19:00:42,retiring to florida extreme heat can age you faster new study finds,extreme heat,None,,https://bsky.app/profile/nypost.com/post/3lj42sdt74o2z,0.0
3727332,2025-02-26 18:00:18,flooding  extreme heat are real in   will invest in clean energy protect our greenspaces  help condo owners get affordable efficiency upgrades its time for a climate plan that works for people  the planet,"flood, flooding, extreme heat",None,#mississaugacentre. #ontariogreens #onpoli #climateaction,https://bsky.app/profile/chitchatwithchan.bsky.social/post/3lj3xgegfwg2a,0.8977
37463322,2025-02-26 17:17:14,its amazing that the camera that captured this was able to function so well in the extreme heat of hell,extreme heat,None,,https://bsky.app/profile/llives7538.bsky.social/post/3lj3uzdcxg22h,0.1723
5535533442,2025-02-26 16:51:25,great i learned so much from your boulder dam book i recently found a distant relative in my family tree who was a concrete engineer at grand coulee my mother was thrilled with my story of working with concrete in extreme heat winking_face,extreme heat,None,,https://bsky.app/profile/pgtk.bsky.social/post/3lj3tl4da4c2w,0.8832
6242667332,2025-02-26 17:06:59,poorer suburbs and regions with large elderly populations are especially vulnerable to extreme heat from climate change updated modelling shows,extreme heat,None,,https://bsky.app/profile/theqldr.bsky.social/post/3lj3ugzknrz2t,-0.5709
76224623342,2025-02-26 16:18:13,"water_wave  today in com is the amoc on the brink of collapse

unlikely before 2100but the risks are real police_car_light  

we find southern ocean winds keep this vital ocean heat engine running even under extreme  but the pacific holds a surprise

tinyurlcomyt6u4e7d 
lets explore test_tube backhand_index_pointing_down",None,collapse,#climatechange.,https://bsky.app/profile/jonbakerocean.bsky.social/post/3lj3rp4hxfk2n,-0.2263
52537337622,2025-02-26 16:04:31,"hey heres a thing this is for autistic folks in particular but anybody who is living with anxiety as well 

followed users only because reasons

when environmental conditions fires floods heat turn extreme do you use that to learn from

we do and have for several years now",flood,"body, conditions, fire",,https://bsky.app/profile/solidaddecosta.bsky.social/post/3lj3qxc762s2l,0.1531
634263352,2025-02-26 15:55:01,"anhe research forum presents characterizing pediatric discharge diagnoses associated with daily extreme heat exposure 

loudspeaker  guest speaker dr sarah oerther phd med rn fnpbc fnap anef
calendar  date march 27th 2025
alarm_clock  time 3 pm et

register now down_arrow 

link  zurlco1hqw3",extreme heat,None,,https://bsky.app/profile/envirn.bsky.social/post/3lj3qgd5qhr2v,-0.4003
242332,2025-02-26 15:28:59,when their running from extreme heat and storms,"storm, extreme heat",None,,https://bsky.app/profile/laury24.bsky.social/post/3lj3oxqkluk2n,0.0
6324332,2025-02-26 15:16:42,if heat pumps are to take off in this country they need to be able to cool the house as well as heat it extreme heat waves are going to become more frequent,extreme heat,None,,https://bsky.app/profile/ivor.bsky.social/post/3lj3obssoys2t,0.5267
6443352,2025-02-26 15:14:14,"extreme heat may lead to more hospitalizations among those living with alzheimers disease and related dementias adrd according to a new research in jama internal medicine coauthored by eh research scientist delaneybskysocial

read more here loomlynxxbs8",extreme heat,None,,https://bsky.app/profile/harvardenvhealth.bsky.social/post/3lj3o5egbdk2r,0.0
66633672,2025-02-26 14:21:10,how can you help someone who is unsheltered and experiencing needs related to hypothermia extreme heat or may want to access shelter in dc call 2023997093 for help,extreme heat,shelter,,https://bsky.app/profile/friendshipplace.bsky.social/post/3lj3l6iav7c2k,0.6908
24233642,2025-02-26 10:27:30,"just so were clear lets start with why bother

were seeing record heat  100 caused by our emissions  and extreme weather from floods to droughts to heatwaves

ipcc says netzero is only way to stop this getting worse



210","heatwave, flood, drought",None,,https://bsky.app/profile/drsimevans.carbonbrief.org/post/3lj364ojidd2w,-0.5888
222347272,2025-02-26 20:16:47,happens every year cold snap followed by warmth yet business still keep the temperatures as if its six below outside,cold snap,None,#roastinginhere,https://bsky.app/profile/sportswritersinc.bsky.social/post/3lj472f7vwk2i,0.4588
227656477234527,2025-02-26 19:49:26,"a oneandahalfmonthold baby girl sila abdel qader has died in gaza city due to a harsh cold snap and israels blocking of shelters from entering the enclave says the palestinian health ministry

red_circle  live updates ajeiofsm220",cold snap,shelter,,https://bsky.app/profile/aljazeera.com/post/3lj45jgjzqs27,-0.8442
7633422,2025-02-26 18:56:00,912 of the eggs have hatched one more has pipped and another one of rocking the last one i have suspected all along wouldnt turn out but not a bad hatch rate from some eggs i ordered online during a crazy cold snap,cold snap,None,,https://bsky.app/profile/goobalicious.bsky.social/post/3lj42jwyqpc2c,0.1323
737633462,2025-02-26 18:47:08,a sunny morning and a run that felt sunny apparently the slog of project run a bit faster is paying dividends and after the late january early february cold snap spring is springing with vigor,cold snap,None,,https://bsky.app/profile/coastal-quince.bsky.social/post/3lj3zzx46xs2a,0.5994
523332322,2025-02-26 18:45:53,shorty we had a brief cold snap where it was a 0 windchill factor i got out of my truck to get gas and then i got right back in,cold snap,None,,https://bsky.app/profile/carriealison.bsky.social/post/3lj3zxu2a322m,0.0
44657233423,2025-02-26 18:45:49,it can help reduce the severity and duration  not allow you to skip it altogether try adding chinese herbal meds like cold snap or wellness formula with some oregano oil personally i find it helps with the duration,cold snap,None,,https://bsky.app/profile/4w3s0m3.bsky.social/post/3lj3zxqcf4c23,0.7298
645433722,2025-02-26 18:34:05,i feel like fools spring was that balmy interim before the cold snap and snowfall when i was posting flower pictures and now were in the spring of deception,cold snap,None,,https://bsky.app/profile/jagbsn.bsky.social/post/3lj3zcnfw722n,-0.1027
467333252,2025-02-26 18:15:05,seven children die amid cold snap in gaza,cold snap,None,,https://bsky.app/profile/news-feed.bsky.social/post/3lj3yas2s5q2y,-0.5994
64336227,2025-02-26 17:34:33,the annual early march cold snap,cold snap,None,,https://bsky.app/profile/incitata.bsky.social/post/3lj3vyck62s27,0.0
455333522,2025-02-26 16:19:22,meanwhile six babies die of hyperthermia in  cold snap health officials say the deaths highlighted the brutal humanitarian conditions in the palestinian enclave despite a ceasefire doctors said,cold snap,"conditions, death, fire",#gaza,https://bsky.app/profile/whodat35.bsky.social/post/3lj3rrtgu522z,-0.8402
3476375332,2025-02-26 15:11:08,the 4th cherry blossom 桜 sakuraforecast for 2025 is here tokyo is expected to lead the bloom on march 21 with yokohama fukuoka and kochi following on march 22 despite the recent cold snap slowing bud growth warmer temperatures in late march should speed things up cherry_blossom,cold snap,None,#japantravel,https://bsky.app/profile/currenltyjapan.bsky.social/post/3lj3nxuawsk2o,0.6239
7743322,2025-02-26 14:51:04,now seven children frozen to death in this latest cold snap due to the denial of shelter and warm clothes,cold snap,"death, shelter",,https://bsky.app/profile/morganeoneill.bsky.social/post/3lj3mtvow2c2v,-0.4588
76653372,2025-02-26 14:22:05,the cold snap we have had had def made mine worse massage help but i havent been able to get one,cold snap,None,,https://bsky.app/profile/erincandy.bsky.social/post/3lj3l7zrfck2w,-0.0516
467333422,2025-02-26 13:44:29,"a oneandahalfmonthold baby girl sila abdel qader has died in gaza city due to a harsh cold snap and israels blocking of shelters from entering the enclave says the palestinian health ministry

red_circle  live updates",cold snap,shelter,,https://bsky.app/profile/news-feed.bsky.social/post/3lj3j4wmivn22,-0.8442
2243336525,2025-02-26 13:43:31,hardly slept last night but the cold snap has broken for now and im drinking my coffee on the porch listening to birds singing in the warming latewinter sunshine holding on to the little joys in life,cold snap,None,,https://bsky.app/profile/toastie-tofu.bsky.social/post/3lj3j36wp5s25,0.7105
6233224,2025-02-26 13:22:27,"i am so glad the cold snap weve been in the past couple weeks seems to be over

please more warm weather folded_hands",cold snap,None,,https://bsky.app/profile/draconicashe.bsky.social/post/3lj3hvjawx224,0.8105
5226333352,2025-02-26 12:15:32,"vrhaka showing off her magic for you flashes of lightning and fire and ice that should be dangerous deadly even but she wields them with such precision that you feel completely safe

and then she tells some joke like get ready for a cold snap and you groan long before the blizzard is conjured","blizzard, cold snap","danger, dead, deadly, fire",,https://bsky.app/profile/lothlanembers.bsky.social/post/3lj3e5uinjs2o,0.9028
437633352,2025-02-26 11:41:26,we had a cold snap a couple weeks ago and the days high was under 40f and thats my lightest color in my temperature layout you cant really tell the difference in the picture but i drew an arrow to show which day it is and its more obvious in daylight next up a spate of warmer weather 7,cold snap,None,,https://bsky.app/profile/dinajames.com/post/3lj3carpr5k2s,0.4215
3223372,2025-02-26 11:12:31,spring is definitely imminent until the usual cold snap comes along again,cold snap,imminent,,https://bsky.app/profile/somemelodiousplot.bsky.social/post/3lj3an7lfvc2c,0.4019
62463553222,2025-02-26 08:01:01,i share your cynical perspective susan but it had enough of an impact for republican leadership to tell their peeps to stop having town halls and they can pry my vote out of my cold dead hands fwiw cutting my medicaid and snap will speed that process up so woman_shrugging_mediumlight_skin_tone,None,dead,,https://bsky.app/profile/medusa-laughs.bsky.social/post/3lj2vwqssls22,-0.8934
662774563222,2025-02-26 07:59:08,not put my winter clothes yet it gets warm then hits us with a cold snap  its frustrating trying to protect my young trees,cold snap,None,,https://bsky.app/profile/daniel-p-johnson.bsky.social/post/3lj2vtekxt22d,-0.3182
75635623252,2025-02-26 07:06:50,millions of people are going to be impacted by this and some of them are going to snap and there will be a lot of billionairesnazis knocked out cold then the rest of them give up their wealth or move to russia to suck putins dick,None,impacted,,https://bsky.app/profile/mrobespierre.bsky.social/post/3lj2svtr5zs2c,-0.4588
4723222,2025-02-26 04:51:05,"a bioengineered disease is mutating humans into terrifying abominations
the world is on the line and the clock is ticking
get coms survivors club here bitlysurvclub
get the duology with the sequel ashfall for 25 off at our store bitlynapstore",ashfall,"survivor, terrifying",,https://bsky.app/profile/notapipe.bsky.social/post/3lj2ld2wqfi2q,-0.5719
472322,2025-02-26 04:50:05,"a bioengineered disease is mutating humans into terrifying abominations
the world is on the line and the clock is ticking
get coms survivors club here bitlysurvclub
get the duology with the sequel ashfall for 25 off at our store bitlynapstore",ashfall,"survivor, terrifying",,https://bsky.app/profile/notapipe.bsky.social/post/3lj2lbbxkeu2e,-0.5719
47232742,2025-02-26 04:49:05,"a bioengineered disease is mutating humans into terrifying abominations
the world is on the line and the clock is ticking
get coms survivors club here bitlysurvclub
get the duology with the sequel ashfall for 25 off at our store bitlynapstore",ashfall,"survivor, terrifying",,https://bsky.app/profile/notapipe.bsky.social/post/3lj2l7i4acl2z,-0.5719
53732227,2025-02-26 04:18:08,"concept city 
red_paper_lantern ashfall citydashing_away",ashfall,None,#art #artwork #conceptart #city],https://bsky.app/profile/makosleepy.bsky.social/post/3lj2jhzh2sc27,0.0
567334657322,2025-02-26 20:06:34,good plan the only way id stop is the asteroid or perhaps a yellowstone eruptionbut dont think of any of that,eruption,None,,https://bsky.app/profile/savedemocracy123.bsky.social/post/3lj46i5a73s22,0.1779
274345422,2025-02-26 19:54:41,hahaha oh nooooooo in fairness this is a weird eruption from one of the nations least trustworthy sources,eruption,None,,https://bsky.app/profile/craigburley.com/post/3lj45svey422u,-0.0062
7566443422,2025-02-26 18:55:54,lava from hawaiis kilauea volcano spews showers of gold 600 feet in the air during latest eruption,eruption,None,,https://bsky.app/profile/nypost.com/post/3lj42jrdoth2g,0.0
265233422,2025-02-26 18:51:47,"the sports court separated from the crash crisis welcomed by a volcanic eruption
via sky news arabia
machine translated","volcanic eruption, eruption","crash, crisis",,https://bsky.app/profile/project-push.tk.gg/post/3lj42cfyygu2n,-0.6597
536342472,2025-02-26 18:48:24,"episode 11 of the kīlauea summit eruption paused today at 706 am hst on february 26 within hawaii volcanoes national park after erupting for 12 hours and 44 minutes

usgs update volcanoesusgsgovhanspublic

short sweeeet and lavatastic",eruption,None,,https://bsky.app/profile/bctiggygirl.bsky.social/post/3lj4247szxc2g,0.0
6453335332,2025-02-26 18:45:38,currently bskysocial is staring at me in despair because a woman on come dine with me made hake vesuvius with a tomato sauce lava and im annoyed because vesuvius was a pyroclastic eruption with no delicious spicy lava,eruption,None,,https://bsky.app/profile/lhardingwrites.bsky.social/post/3lj3zxgspdk2o,-0.7844
67473322,2025-02-26 18:27:09,we were fortunate enough to be here for this event   planned trip to hawaii months ago  planned day at vnp 2 days earlier  planned to come back to volcano house from north end of the park after dark to catch a glimpse of lava glow  arrived 10 min after eruption started  experience priceless,eruption,None,,https://bsky.app/profile/stablegeenyus.bsky.social/post/3lj3ywcq2wc2n,0.4404
34533222,2025-02-26 18:10:29,"bougainvillea eruption
2022

nature finds a way in merida a hotasitgets concrete citadel",eruption,None,#magenta #februarty #mobilephoto #eastcoastkin #photography,https://bsky.app/profile/lsfstudios.bsky.social/post/3lj3xyfo2p22w,0.0
64375533622,2025-02-26 18:09:10,i have three works in an upcoming exhibit at gallery 408 in camas washington all were inspired by my new home in the pacific north westthe first is an acid etched view of the eruption of mount saint helens in 1980,eruption,None,,https://bsky.app/profile/lorrainechure.bsky.social/post/3lj3xw62nis2f,0.4939
36554332,2025-02-26 18:04:26,a conglomerate stone isnt it beautiful created by an eruption,eruption,None,,https://bsky.app/profile/4loveofnature.bsky.social/post/3lj3xnlwgks2h,0.7096
36673352,2025-02-26 17:37:21,real time eruption of kilauea on hawaii 225 at 1030 pm local  about 1 mile away fountains between 300600 feet,eruption,None,,https://bsky.app/profile/krash63.bsky.social/post/3lj3w5cfntf2v,0.0
6566335462,2025-02-26 17:37:15,yellowstone is a mega volcano just itching to open up that eruption would devastate not only a good portion of the us but affect the world as well i picture god looking down at what is happening in the us and saying the hell with this sht let it blow,eruption,None,,https://bsky.app/profile/greatgrandmacindy.bsky.social/post/3lj3w546zvs2i,-0.7471
37466233325,2025-02-26 17:17:15,"united_states  volcano  kīlauea orange_square 

 the eruption didnt even last until we said goodbye",eruption,None,,https://bsky.app/profile/gongudottir.bsky.social/post/3lj3uzbqm3k25,0.0
52433622,2025-02-26 16:48:20,"february completely banged and we still have another release day ahead of us

favorite february lps

buttholectomy  maggot infested carcass eruption
phrenelith  ashen womb
warlung  the poison touch
pissgrave  malignant worthlessness

eps down_arrow",eruption,None,,https://bsky.app/profile/gabaghoulish.bsky.social/post/3lj3tffq6l22z,-0.128
4542433322,2025-02-26 16:18:32,"what youre advocating for is actually cronyism and corruption but youre calling it free markets

volcanic eruption of anger","volcanic eruption, eruption",None,,https://bsky.app/profile/forevernever.bsky.social/post/3lj3rqg3sk22x,-0.1531
5623342,2025-02-26 16:10:52,the claim of an imminent eruption in sundhnúksgígaröð with little warning seems speculative as its unclear what specific data supports this prediction and geological events are inherently difficult to forecast with certainty,eruption,"events, imminent, warning",,https://bsky.app/profile/zortside.bsky.social/post/3lj3rcnnc4s2c,-0.2431
22524336622,2025-02-26 16:08:22,"both are still there spared by the 80 eruption by location south  southwest side

oles cave is off nf road 83 near its intersection with nf 90 near swift reservoir ape caves a bit further north closer to climbers bivouac",eruption,None,,https://bsky.app/profile/mountsthelens1980.bsky.social/post/3lj3r66wy2k2s,0.2714
2375433422,2025-02-26 15:59:15,"kilauea volcanic eruption

livestream  

webcam  

alert wildfire cam  alertwestlivecamconsole","wildfire, volcanic eruption, eruption","fire, stream",#hawaii,https://bsky.app/profile/mibawi.bsky.social/post/3lj3qnsm4a22k,0.296
