tweet_id,timestamp,tweet_text,matched_disaster_keywords,matched_crisis_keywords,hashtags,post_url,sentiment_score
73353622,2025-04-15 04:59:41,bskysocial  its wonderful to see youre here with us on blue sky mr president hey if moron 47 somehow makes it legal for a third term can we count you in in 2028  nothing would be more delicious than if you run against that racist prick and hand his ass to him in a landslide,landslide,None,,https://bsky.app/profile/davidgilmourfan.bsky.social/post/3lmtc6ogyd22n,-0.3783
66675322,2025-04-15 04:57:31,we have multiple parties running in different ridingor areas some parties dont have a rep everywhere so they wouldnt get in with a pm there are 3 main parties all over in some one party will win with a landslide in others its so close they call it a split vote some try to encourage 1,landslide,None,,https://bsky.app/profile/melodygen.bsky.social/post/3lmtc2ssqpk2c,0.9509
3543753242,2025-04-15 04:57:17,our future all this has helped bolster bukeles popularity at home the president enjoys up to 80 approval and won his reelection in 2024 by a landslide though bullock notes that many are too scared to publicly oppose him,landslide,None,,https://bsky.app/profile/staciegregory.bsky.social/post/3lmtc2dj4qk2g,0.8834
72677326652,2025-04-15 04:48:09,landslide,landslide,None,,https://bsky.app/profile/aricostello.bsky.social/post/3lmtbk2665k2c,0.0
462435622,2025-04-15 03:30:06,how do you spell landslide,landslide,None,,https://bsky.app/profile/mack2114.bsky.social/post/3lmt56icmb22n,0.0
62354352327,2025-04-15 03:27:37,earth angel we saw you from across the bar an crushed by sudden landslide,landslide,None,,https://bsky.app/profile/hotgirl.gay/post/3lmt523envk27,-0.4215
6745543442,2025-04-15 03:21:03,if schumer refuses to leaveretire after aoc bernie or any other true left democrat that supports the people more than anything replaces him in a legit landslide that is,landslide,None,,https://bsky.app/profile/towers-of-obscure.bsky.social/post/3lmt4mow4ls2g,0.6486
254342,2025-04-15 03:14:20,nope about 38 of eligible voters didnt bother to vote votes for trump and harris were very close with trump taking the win no landslide for anyone,landslide,None,,https://bsky.app/profile/tcar2000.bsky.social/post/3lmt4cbhcrk2g,0.5627
67734224,2025-04-15 03:09:57,hitler banned other parties trump probably wont have to the only threat the democrats possibly pose in the sphere of conventional politics is if they win a landslide which can be prevented by some fairly simple undermining of elections that enough of them might even be on board with save act,landslide,None,,https://bsky.app/profile/frogmother.net/post/3lmt42hbztc24,0.2263
6656323522,2025-04-15 02:46:50,"i remember how we had biden in 2019 saying we needed a strong republican party and they did a coup in 2021
and then in 2021 he said it again
and then in 2023 pelosi said it again
and then in 2024 of course we won in a fucking landslide because this worked out so well",landslide,None,,https://bsky.app/profile/mandoqueer.itch.io/post/3lmt2r3vy522x,0.9089
7523462,2025-04-15 02:33:20,"she won
by a landslide
he stole her votes
she let him

electiontruthallianceorg",landslide,None,,https://bsky.app/profile/brambling2.bsky.social/post/3lmszyx4r6c2t,0.5719
3527732,2025-04-15 02:30:13,"long wondered what if trump had handed covid response to experts and stayed out of it offering inspirational teleprompterfed comfort instead of spasmodic eruptions of lies and scapegoating

my bet landslide reelection

but such a course runs counter to trumps fundamental nature","landslide, eruption",None,,https://bsky.app/profile/dsng480.bsky.social/post/3lmsztfrbws2w,0.25
63523742,2025-04-15 02:30:06,"crikey you need to mention that the polls also predicted a landslide victory for bill shorten

this aint over till its over",landslide,None,,https://bsky.app/profile/twangmaker.bsky.social/post/3lmszt74ehk2q,0.0
4323,2025-04-15 02:07:15,lmao just created new yt tt  reddit accounts pretending to be a frothing maga pp fan dropping real facts while hyping up a poilievre landslide so the cons stay home on voting day  theyre lapping it up does this make me chaotic good or just deeply petty with a phd in psychological warfare,landslide,None,,https://bsky.app/profile/eden-bee.bsky.social/post/3lmsylhqojs23,0.7886
3463722,2025-04-15 01:51:13,"elon knows those computers better than anybody
 all those computers
those votecounting computers 
 and we ended up winning pennsylvania like in a landslide",landslide,body,,https://bsky.app/profile/n3rdopolis.bsky.social/post/3lmsxno7rh22j,0.8316
25357325,2025-04-15 01:46:11,call it operation dinner out and win the election in a landslide,landslide,None,,https://bsky.app/profile/forbesmm.bsky.social/post/3lmsxeotdcs25,0.5859
7635234222,2025-04-15 01:43:41,harris in a landslide,landslide,None,,https://bsky.app/profile/bookersghost.bsky.social/post/3lmsxa42ta22z,0.0
5737522,2025-04-15 01:43:16,thete was no landslide  no mandate  just more gop lies,landslide,None,#goplies #trump,https://bsky.app/profile/blueginger99.bsky.social/post/3lmsx7ht5nc22,-0.5252
54622332,2025-04-15 01:27:53,ive tried so many over the years and this has been more effective than the rest by a landslide  so im really bummed im having such a uh severe case of this common side effect  i havent dealt with it to half this degree before and its so frustrating to have this be the tradeoff,landslide,None,,https://bsky.app/profile/sherekhanum.bsky.social/post/3lmswdxahuk2r,-0.4494
655332,2025-04-15 01:26:09,while you try to pull a legal gotcha on the president hes busy deporting babykilling rapemurderersas demanded by the huge majority of the american people by their their landslide election mandate writing this flaming dog poop is even easier than i imagined,landslide,None,,https://bsky.app/profile/danbad23.bsky.social/post/3lmswatfasc2s,0.5719
276474243242,2025-04-15 07:20:26,"might be a little itty bitty sack of balls and cock

but

fertile and sacrad as hell 



 also is that a tornado siren in the background boy run to the shelter yo",tornado,shelter,,https://bsky.app/profile/barebackme.bsky.social/post/3lmtk2dof4c2c,-0.8765
65453622,2025-04-15 07:00:12,when minutes matter in severe weather faster forecasting technology is crucial for saving lives says one noaa meteorologist,tornado,warning,,https://bsky.app/profile/cbsphiladelphia.bsky.social/post/3lmtiw6cf2t2t,-0.3612
473522,2025-04-15 07:00:10,a beloved pet tortoise is reunited with its family weeks after disappearing in a mississippi tornado,tornado,None,,https://bsky.app/profile/fox12oregon.bsky.social/post/3lmtiw52fdw2a,0.5106
4624372,2025-04-15 07:00:06,myrtle a cherished pet tortoise has been reunited with its family in mississippi weeks after disappearing during a deadly tornado outbreak in march,tornado,"dead, deadly",,https://bsky.app/profile/13abc.com/post/3lmtivyq7nh2b,0.5106
4732222,2025-04-15 06:43:18,yup march 24 he panicked when i picked him up to put him in a crate potential adopter meeting and turned into a claw tornado three days in hospital on iv antibiotics,tornado,None,,https://bsky.app/profile/veronicaf.bsky.social/post/3lmthxxa2k222,-0.4588
732,2025-04-15 05:47:26,"departing tornadowarned storm north of damascus arkansasapril 4th

im glad to have chased 4 days in dixie but the photo ops were really difficult i left with just a handful i kind of like so much plotting scheming  maneuvering is needed theres barely time  mental space left for images","tornado, storm",None,,https://bsky.app/profile/perezmedia.bsky.social/post/3lmtetycefc2o,0.0312
426352,2025-04-15 06:33:57,"use tornado in a sentence
im sure a tornado would blow down my garage",tornado,None,,https://bsky.app/profile/geoffreyoleary.bsky.social/post/3lmthhbr5yc2t,0.3818
624332,2025-04-15 06:15:13,the tornado it was gods will,tornado,None,,https://bsky.app/profile/luluhoney.bsky.social/post/3lmtgfqsf3s2y,0.0
433732,2025-04-15 06:14:21,just realized that this is the fourth period of traumatic unemployment ive experienced in the mere 14 years of my independent adult life tail end of the recession escaping dv getting dumped as a stayathomemomgirlfriend long covid doge tornado of doom,tornado,None,,https://bsky.app/profile/emilydwarfield.bsky.social/post/3lmtge73ivc2b,-0.9274
762337532,2025-04-15 05:47:38,also no mention of the fact that the current administrations proposed budget could hinder this research even though they say all tornado warning research will be untouched nssl is one of oarnoaas research labs,tornado,warning,,https://bsky.app/profile/erinroberson.bsky.social/post/3lmteueupfc2r,-0.296
7346367322,2025-04-15 05:42:22,"buckle up or more accurately get in the cellar  i have this image of a tornado 
a trumpnado of who the hell knows what fresh hell 
the trumpnado will bring us as two major issues come to a head as he continues to attempt to desecrate the constitution bc he wants unitary executive power iow king",tornado,None,,https://bsky.app/profile/fckelnmskthnzbllnr.bsky.social/post/3lmtekzfkb22l,-0.836
3437463732,2025-04-15 05:04:02,building a diy tornado tower,tornado,None,,https://bsky.app/profile/hackadayofficial.bsky.social/post/3lmtcghaywc2w,0.0
6765322,2025-04-15 05:02:57,here are 3 additional  that we finished surveying our preliminary running  total from april 2 to april 5 is now 28 storm surveys are still ongoing,"tornado, storm",None,#nwsmemphis): #tornadoes #tornado #arwx #mswx #tnwx #mowx #wx #wxsky,https://bsky.app/profile/stormchaser4850.bsky.social/post/3lmtceeul2k2g,0.0
55343722,2025-04-15 05:01:28,"have an art book
found in a dingy shop
with books stacked against 
long winding corridors
leading to dead ends
a tornado siren blaring
scared huddling against
an interior wall there
it found me the book
never left my side since
i know it didnt save me
from the storm but
it saved me regardless","tornado, storm",dead,,https://bsky.app/profile/acausalqualia.bsky.social/post/3lmtcbpd7e22q,-0.1813
433327722,2025-04-15 04:47:01,now thats a great tornado scene  lololol,tornado,None,,https://bsky.app/profile/greenellsworth.bsky.social/post/3lmtbi277d22d,0.7405
33362323,2025-04-15 04:37:29,the us experiences an average of 1000 tornadoes each year with majority of them occurring in tornado alley and dixie alley,tornado,None,,https://bsky.app/profile/makkkiiio.bsky.social/post/3lmtawykpxs23,0.0
5774453272,2025-04-15 04:33:38,"a town named tornado was just outside a tornado warning zone

sure why not that might as well happen",tornado,warning,,https://bsky.app/profile/isisstormdragon.bsky.social/post/3lmtapuq27k2e,0.25
334362,2025-04-15 04:31:32,stellaluna sleeps with a slew of influencers over like a month and a half but its solely to steal their clothes she can afford them its just more fun to sneak them out of the closet after knocking them out after hours of employing the tornado tongue,tornado,None,,https://bsky.app/profile/hazbinhovel.bsky.social/post/3lmtaouit6s2f,0.3269
227352,2025-04-15 04:32:56,"truly one of the best cloud days ever  

hope everyone was safe lots of hail that came with these storms and some tornado warnings

a great reminder to have an action plan ready in case you need to act fast","tornado, storm, thunderstorm",warning,#weather #thunderstorms #stormyweather #clouds,https://bsky.app/profile/elspheccaire.bsky.social/post/3lmtaorm5ek2s,0.9595
55263623325,2025-04-15 04:22:05,"feds pull 9 million for tornadostricken alabama school district reading program panic

hi alabama trump voters you bought this

make it right april 19 details at
fiftyfiftyone",tornado,None,,https://bsky.app/profile/pseudosudio.bsky.social/post/3lmta3gmrgk25,0.0
256372226,2025-04-15 04:14:27,"hey this is kind of cool  initially about the birth of tornado forecasting in the united states

youtubecomwatchvw7o7",tornado,None,,https://bsky.app/profile/geographile.bsky.social/post/3lmt7nr2fb226,0.5868
46733372,2025-04-15 04:12:34,apparently while i was speed writing a 6 page paper that was due tonight finished it on time with 8 minutes left a small tornado went past and then baseball sized hail fell like wtf we have hail sometimes but not that bad tornadoes are new usually dont survive the mountains,tornado,None,,https://bsky.app/profile/8bitmermaid.bsky.social/post/3lmt7kghrmc2n,0.5838
43544332,2025-04-15 07:32:44,"right blizzard belongs to microsoft after all

still wondering if the weapons wont be usable in at least the ps5 version since they are basically the black dogscarlet viper set which are afaik are only available on steamxbox or ps5",blizzard,None,,https://bsky.app/profile/bowtieshyguy.bsky.social/post/3lmtkqed3pc2c,-0.4404
37232,2025-04-15 07:18:30,"there was a whole todo his parents and police got involved

days later he turned up on the canadian border in bad shape without shoes his feet almost frostbitten off

he had suddenly decided to go camping alone deep in the canadian wilderness the night of a major blizzard

no wallet or room key",blizzard,None,,https://bsky.app/profile/azurelore.bsky.social/post/3lmtjwtkimc2r,-0.7893
6373432,2025-04-15 07:09:08,"truth is it doesnt make much sense that zandalari live as long as the people who sipped the well of eternity and its replacement for 10k years

however blizzard writing is about as cohesive as molten cheese so we just gotta say times change from time to time",blizzard,None,,https://bsky.app/profile/cakelatte.bsky.social/post/3lmtjg43icc2v,0.5267
3273724,2025-04-15 07:07:41,"when pve mode overwatch 2 
 new ability change skins pls blizzard",blizzard,None,,https://bsky.app/profile/pigycanfixit.bsky.social/post/3lmtjdk7qbc24,0.4515
7344732,2025-04-15 06:49:57,"another late night watching the boob tubetime to dream friends

after the blizzardlike winds  snow today we were left with grey skies  sad birds waiting for the pond to thaw again",blizzard,None,,https://bsky.app/profile/prairiecanuck.bsky.social/post/3lmtidosjec2s,0.3595
45363352,2025-04-15 06:46:18,"2tps16

blizzard entertainment2025415fps 2pc  ps5  ps4  xbox series xs  xbox one  nintendo switch16 52bo74tps",blizzard,None,,https://bsky.app/profile/inmobi-info.bsky.social/post/3lmti5cpxtz2f,0.0
234732,2025-04-15 06:37:34,blizzard has a 10year roadmap and plan for diablo 4 and the diablo series,blizzard,None,,https://bsky.app/profile/tweaktown.com/post/3lmthnptify2s,0.0
654762223242,2025-04-15 06:09:13,whats worse is that more newer people are only familiar with df wrathion blizzard did him incredibly dirty there and portrayed him as someone who acts like an infant,blizzard,None,,https://bsky.app/profile/peanutproto.bsky.social/post/3lmtg2zj4rk2r,-0.5849
43737523,2025-04-15 05:09:45,if they are imposed trumps blizzard of reciprocal tariffs will hit beneficiaries of the african growth and opportunity act more than most,blizzard,None,,https://bsky.app/profile/dailymaverick.co.za/post/3lmtcqph75j23,0.7845
2263722,2025-04-15 04:45:41,yeah okay ill probably play the next overwatch season for the magical girl battlepassi already fucked up and missed it when paladins did it years agolazy blizzard copying a superior product again,blizzard,None,,https://bsky.app/profile/onyxoblivion.bsky.social/post/3lmtbfq7zd22b,0.34
5572332,2025-04-15 03:01:53,my screen time is way down because anytime i log back in here i start shaking like a chihuahua in a blizzard,blizzard,None,,https://bsky.app/profile/buttpraxis.bsky.social/post/3lmt3lzzhws2x,0.2023
456644324722,2025-04-15 02:47:57,oh great albertas wildfires have already started and yet there was a blizzard in calgary on saturday great province we have here s,"wildfire, blizzard",fire,,https://bsky.app/profile/amandalhu.bsky.social/post/3lmt2t4jm722b,0.8481
4532,2025-04-15 02:20:34,like the great blizzard of 2018 we will rise,blizzard,None,,https://bsky.app/profile/dandyfarnsworth.bsky.social/post/3lmszbpmklk2y,0.765
6463372,2025-04-15 02:12:08,"importance 35100
    

overwatch 2 set to introduce stadium mode a major evolution for the hero shooter since its initial release in may 2016 blizzard entertainments",blizzard,shooter,#news #technology #launch #stadium #competition,https://bsky.app/profile/newsflash.one/post/3lmsyt3ot7l2r,0.7269
543722,2025-04-15 01:43:17,blizzard has gotta know at this point that placing mobs in front of resources like this only ever ensures some selfish buttknuckle will swipe it out from under you while youre fighting some trash,blizzard,None,,https://bsky.app/profile/mkultra.monster/post/3lmsx7hyaq22a,-0.4767
7372232,2025-04-15 01:31:00,blizzard north of nowhere,blizzard,None,#art #photography,https://bsky.app/profile/scazrelet.bsky.social/post/3lmswjharbc2e,0.0
7344375443322,2025-04-15 01:26:34,"where are the impeachments for the ag dhs and trump

that is what congress should be doing

the gop when they were in the minority sent forth a blizzard of impeachment paperwork for every imagined minor offense but here we have direct 1st 4th and 5th amendment violations and nothing",blizzard,None,,https://bsky.app/profile/jcwill324.bsky.social/post/3lmswbmbic22b,-0.128
433256343523,2025-04-15 01:21:20,"ive done my taxes most of a load of laundry and a large royal strawberry cheesecake blizzard

big day",blizzard,None,,https://bsky.app/profile/everwake.bsky.social/post/3lmsvybqc5c23,0.0
3372,2025-04-15 01:05:32,blizzard game,blizzard,None,,https://bsky.app/profile/luna.pds.invoxiplaygames.com/post/3lmsv3f7jas2w,0.0
5434722,2025-04-15 00:53:18,i know its kind of antiblizzard propaganda but i never wanted to play horde but it was also the only faction anyone i knew at the time was joining,blizzard,None,,https://bsky.app/profile/mkultra.monster/post/3lmsug4y7k22a,-0.4685
26362,2025-04-15 00:41:12,hello blizzard iii,blizzard,None,,https://bsky.app/profile/dirtyelfb.bsky.social/post/3lmstqibz6k2f,0.0
523253223,2025-04-15 00:38:25,was wow ever publicly referred to as an everquestkiller by anyone even adjacent to blizzard because that would be the only one i could possibly think of,blizzard,None,,https://bsky.app/profile/tommyfists.bsky.social/post/3lmstlfx2vk23,0.5859
527434225,2025-04-15 05:46:04,twister,twister,None,#dongsales,https://bsky.app/profile/pretzalqueen.bsky.social/post/3lmterl4ee225,0.0
35532,2025-04-15 05:04:50,ive still got twister out,twister,None,,https://bsky.app/profile/seanherrala.bsky.social/post/3lmtchvebic2z,0.0
4365673762662,2025-04-15 04:05:39,all annunciation up in this titty twister,twister,None,,https://bsky.app/profile/cholulaconamor.bsky.social/post/3lmt762u66s2n,0.0
256636652,2025-04-15 03:52:16,"daily physical media showcase day 151 152 153 154
days of thunder 
super smash bros for wii u
twister
hear it now play later",twister,None,,https://bsky.app/profile/atdm.bsky.social/post/3lmt6fyj65s2g,0.743
6655352,2025-04-15 03:42:33,monopoly goes downhill very quickly  sidenote id love to play twister with you ash,twister,None,,https://bsky.app/profile/atomspark95.bsky.social/post/3lmt5urcsgc2p,0.9348
6452343326,2025-04-15 03:07:10,en medio de la serie annemarie martin se cas con michael crichton coescribieron twister,twister,None,,https://bsky.app/profile/cinebraille.bsky.social/post/3lmt3vhtnhk26,0.0
7777332,2025-04-15 03:02:51,"here is a new tongue twister we will be teaching our children 

oh shit an auschwitz by the 
sea shore",twister,None,,https://bsky.app/profile/thebnk3r.bsky.social/post/3lmt3nqylwk2a,-0.5574
4576352,2025-04-15 02:06:09,"vesselalert
name twistersar
mmsi 244070456
callsign pc5692
type sar
flag netherlands
seen 15apr2025 040547 cest
speed 35 kts
distance 60 nm
signal rssi 85 dbfs
ship ais vesselalert  kx1t   link",twister,None,,https://bsky.app/profile/aisfriesland.bsky.social/post/3lmsyiep5hw2u,0.0
6545373622,2025-04-15 01:44:27,i saw a young lady enjoying a solo game of twister today you sometimes see such interesting things on the streets of chicago,twister,None,,https://bsky.app/profile/vaughnchicago.bsky.social/post/3lmsxbh6ybc22,0.7269
275432,2025-04-15 01:03:31,ugh i hate this game someone always gets ahead and then its just awful for everyone else that one with the dumb metal car really got what was comin to them though  pretty sure they cheated anyway next time were playing twister,twister,None,#sizesky #giantess,https://bsky.app/profile/mountainousash.bsky.social/post/3lmsuycbplk2w,-0.8689
35333426,2025-04-15 00:46:05,"conscientious objector

facing a deadly confrontation all hands ready voyager for battle except tuvok who has a moral objection chakotay lets an unemployed asteroid spend the night on his couch but soon it wont leave",None,"dead, deadly",#startrekvoy,https://bsky.app/profile/foundepisodes.bsky.social/post/3lmstz4otec26,-0.25
32532225,2025-04-15 00:37:06,welcome to my twister mind,twister,None,,https://bsky.app/profile/chasetrickery.bsky.social/post/3lmstj2knn225,0.4588
52346776352,2025-04-15 00:18:52,underrated song always love thinking back to the scene from twister,twister,None,,https://bsky.app/profile/coltondav426.bsky.social/post/3lmssik5tjc2g,0.6369
5435333772,2025-04-15 00:11:33,my pals have no clue why i insisted on playing twister tonight not only do i get to see their butts i also get to have a big lunch which gives me a secret weapon to win it all,twister,None,,https://bsky.app/profile/windywolf.bsky.social/post/3lmss3hs77s2e,0.6369
6732,2025-04-14 23:20:39,the best scene in twister is when jonas and eddies truck gets sucked up by the tornado and makes a cartoonish acme rocket whistling noise before exploding eddie is already impaled at this point so idk if he got to enjoy it but it does rule,"tornado, twister",None,,https://bsky.app/profile/scottforreal.bsky.social/post/3lmspagvucc2x,0.3109
7343722,2025-04-14 23:16:27,pinky ponky pinked a pock of puckered popuser was shot for this tonguetwister,twister,shot,,https://bsky.app/profile/overthere.banginsummer.love/post/3lmsoyxc72s2a,0.0
25422632,2025-04-14 22:52:14,i used to think it was like a twister i walk alonewhich made sense to me because you never see multiple twisters togetheror at least i hadnt,twister,None,,https://bsky.app/profile/labelsoren.bsky.social/post/3lmsnnnhegk2z,0.3612
36332,2025-04-14 22:34:09,for the record i have 4 cats but only 3 like to play twister,twister,None,,https://bsky.app/profile/dakall.bsky.social/post/3lmsmnectvs2a,0.7469
55723227,2025-04-14 22:21:55,"pfl 2 results marcirley alves upsets leandro higo jake hadley lands rare scottishtwister

things got spicy in the pfls sophomore effort this season on friday night at universal studios florida in orlando pfl 2 featured the first rounds of the pfl bantamweight and womens flyweight",twister,None,,https://bsky.app/profile/cavenewstimes.com/post/3lmslxg2tfq27,-0.3612
66243232,2025-04-14 22:03:15,imagine living in an apartment building below a 90yearold neighbour attempting to play twister with her three cats,twister,None,,https://bsky.app/profile/qwertying.bsky.social/post/3lmskw2by3s2k,0.34
24653532,2025-04-14 20:28:10,dats wild str8 cap i dont know who u are but u give tongue twister champion aura,twister,None,,https://bsky.app/profile/gucciandmoneyz.bsky.social/post/3lmsflzfpas2q,0.7469
773752,2025-04-14 19:53:10,twister,twister,None,,https://bsky.app/profile/republicandiet.bsky.social/post/3lmsdnf7q5c2z,0.0
65332,2025-04-15 01:48:35,"high water mark is a   about a  who makes landfall to save her friend

with humanity driven into the sea what lurks above the waves dare to find out  
bitly3cxzxlh",landfall,None,#postapocalyptic #fantasy #mermaid #freebook #indiereads,https://bsky.app/profile/evelynchartres.bsky.social/post/3lmsxixhplv2c,0.7059
556342,2025-04-15 00:37:01,the us contribution to the war effort was immense but us didnt save europes ass it was a combined effort of all allies and by the time us made landfall in europe germany had already been losing the war on the eastern front for 3 years bc of germany was lacking oil to keep the war going,landfall,None,,https://bsky.app/profile/bigdickmccree.bsky.social/post/3lmstiyxa4s2t,-0.9532
625332,2025-04-15 00:04:51,"i love her 
she wouldnt be all that or of place on the weather channel when they send correspondents to report on hurricanes as theyre making landfall","hurricane, landfall",None,,https://bsky.app/profile/overstatedpathos.bsky.social/post/3lmsrpicpps2q,0.6369
66574322,2025-04-14 22:31:05,fetches do aid with landfall like abilities but technically only one of the cards i am talking about playing with so far actually has landfall printed on the version i play with,landfall,None,,https://bsky.app/profile/bloodmoonapologist.bsky.social/post/3lmsmhtegnc22,0.7615
6657432,2025-04-14 22:19:19,heck the landfall isnt even the text on courser that causes you issues that would be the playing lands from top of library,landfall,None,,https://bsky.app/profile/bloodmoonapologist.bsky.social/post/3lmslsrypcc2a,0.3818
66574352,2025-04-14 22:18:18,and as i have shown the landfall to gain 1 life is not the problem or even evil,landfall,None,,https://bsky.app/profile/bloodmoonapologist.bsky.social/post/3lmslqxq5bs2a,0.0665
2537457362,2025-04-14 22:17:11,it literally has landfall i will not apologize,landfall,None,,https://bsky.app/profile/hobbesq.bolasgang.com/post/3lmsloxo6nk2b,-0.1501
665743227,2025-04-14 19:30:56,hobbes my landfall triggers isnt the evil part of the deck,landfall,None,,https://bsky.app/profile/bloodmoonapologist.bsky.social/post/3lmscfojdu227,0.5448
253745737352,2025-04-14 18:37:12,evil magic the gathering players be like landfall trigger,landfall,None,,https://bsky.app/profile/hobbesq.bolasgang.com/post/3lms7fp3s5s2b,-0.4404
26246253623,2025-04-14 18:20:17,"korea the avant guardian 7 has finally made landfall in your country ft two of your best bands 18fevers and turn for our singing lead on the bside 18fevers is kind enough to help us get it in your hands

18feverscomstore

pick up something from them as well they absolutely rip",landfall,None,#ska,https://bsky.app/profile/thebandmutiny.bsky.social/post/3lms6hearms23,0.9228
