event_name	tweet_id	tweet_text	image	label
iraq_iran_earthquake	930028600992165000	Some #pictures from #earthquake #Iran-Iraq border in Kermanshah shows different #damages. 	data_image/iraq_iran_earthquake/13_11_2017/930028600992165888_1.jpg	severe_damage
hurricane_maria	912376057365504000	@JoyAnnReid . Almost all food crops (agriculture) hence livelihoods have been devastated by hurricane 'Maria'. . 	data_image/hurricane_maria/25_9_2017/912376057365504001_0.jpg	severe_damage
hurricane_irma	909946459692392000	Hurricane Irma threatens Florida's bustling tourism industry  	data_image/hurricane_irma/19_9_2017/909946459692392448_0.jpg	little_or_no_damage
california_wildfires	918109126307311000	Lord we pray you give mercy on California and ease the winds today so firemen can get a handle of this fire. 	data_image/california_wildfires/11_10_2017/918109126307311619_0.jpg	severe_damage
hurricane_irma	909774325305225000	.@CenturyLink offers free call forwarding, waives late fees, and more for #Florida customers impacted by #Irma 	data_image/hurricane_irma/18_9_2017/909774325305225216_0.jpg	mild_damage
hurricane_harvey	905956874838736000	#Harvey 'deadline' on #insurance claims is wrong, experts say  	data_image/hurricane_harvey/8_9_2017/905956874838736896_0.jpg	severe_damage
hurricane_maria	913892408621981000	Hurricane wiped out Puerto Rico's vibrant ag economy.  	data_image/hurricane_maria/29_9_2017/913892408621981696_0.jpg	mild_damage
hurricane_maria	913129126881570000	Hurricane Maria destroyed the manatee lab and veterinary clinic. The manatees are safe. Help by donating to rebuild! 	data_image/hurricane_maria/27_9_2017/913129126881570816_1.jpg	mild_damage
hurricane_irma	909421107396186000	RT @CMCOLive: Hurricane Irma: How you can help.  via @USATODAY 	data_image/hurricane_irma/17_9_2017/909421107396186112_0.jpg	mild_damage
iraq_iran_earthquake	930308604200026000	A terrifying chill runs down the spine seeing these images from earthquake-hit Iraq. God give them strength. 	data_image/iraq_iran_earthquake/14_11_2017/930308604200026112_0.jpg	severe_damage
hurricane_irma	909746257970761000	Free temporary roof from @USACEHQ for those damaged by #Irma. Call # on screen. Thanks @wjxt4 #IrmaRecovery 	data_image/hurricane_irma/18_9_2017/909746257970761728_0.jpg	severe_damage
hurricane_maria	923717142587105000	.@AaronDKlein says Puerto Rico's key problems have nothing to do with the Jones Act:  	data_image/hurricane_maria/27_10_2017/923717142587105280_0.jpg	severe_damage
california_wildfires	920430848398069000	Lost and Found: Keepsakes pulled from the ruins of California wildfires  	data_image/california_wildfires/17_10_2017/920430848398069760_0.jpg	severe_damage
hurricane_maria	911584945470099000	RT @VisitLift: Pray for all families! #Visitlift #Hurricanemaria 	data_image/hurricane_maria/23_9_2017/911584945470099456_0.jpg	little_or_no_damage
hurricane_maria	928606891063771000	FEMA, at long last, offers to airlift Puerto Rico hurricane victims to mainland.  	data_image/hurricane_maria/9_11_2017/928606891063771136_0.jpg	severe_damage
hurricane_irma	909731011411378000	Run, Rock 'n' Roll  and de-stress from Hurricane Irma  	data_image/hurricane_irma/18_9_2017/909731011411378177_0.jpg	severe_damage
california_wildfires	921089830074929000	California wildfires roundup: Latest details, map  	data_image/california_wildfires/19_10_2017/921089830074929153_0.jpg	mild_damage
iraq_iran_earthquake	930180496507752000	Iran-Iraq earthquake: The villages havevanished  	data_image/iraq_iran_earthquake/13_11_2017/930180496507752448_0.jpg	severe_damage
california_wildfires	917933078969966000	Well-known Houston professor hit by Harvey and California wildfires  	data_image/california_wildfires/11_10_2017/917933078969966592_0.jpg	mild_damage
mexico_earthquake	911784599163895000	Mexico Earthquake Relief Fund  #Jewish #SanDiego 	data_image/mexico_earthquake/24_9_2017/911784599163895810_0.jpg	severe_damage
hurricane_maria	911729811877449000	@CaseyNeistat Check out Old San Juan PR after #HurricaneMaria E we need help 	data_image/hurricane_maria/23_9_2017/911729811877449729_0.jpg	severe_damage
hurricane_harvey	904655830108200000	13 toxic waste sites pose public threat due to Harvey floodwater, EPA finds  	data_image/hurricane_harvey/4_9_2017/904655830108200960_0.jpg	severe_damage
california_wildfires	917817013409583000	Wildfires sweep through California wine country  	data_image/california_wildfires/10_10_2017/917817013409583106_0.jpg	severe_damage
california_wildfires	919660981462228000	#House #Burned #Down My House Burned Down- California Fire  	data_image/california_wildfires/15_10_2017/919660981462228992_0.jpg	severe_damage
hurricane_irma	910000060225728000	"@NelsonHavi I gather ""IRMA"" hit some parts of Kenya? "	data_image/hurricane_irma/19_9_2017/910000060225728512_0.jpg	severe_damage
hurricane_harvey	905386004076486000	From Rescues to Relief, Principals' Response to Harvey Aided By Ed Tech  via @educationweek 	data_image/hurricane_harvey/6_9_2017/905386004076486656_0.jpg	severe_damage
mexico_earthquake	913092121292410000	Families in #Tlalnepantla, #Morelos, Receive Govt Help after #MexicoEarthquake  	data_image/mexico_earthquake/27_9_2017/913092121292410883_0.jpg	severe_damage
hurricane_harvey	904947742224650000	How Harvey Could Provide Disaster Relief for Trump and Congress  	data_image/hurricane_harvey/5_9_2017/904947742224650241_0.jpg	severe_damage
hurricane_irma	910212336522350000	RT @Acemaaxinfo: Hurricane Irma: 100 High Risk Prisoners Or More, Have Escaped  	data_image/hurricane_irma/19_9_2017/910212336522350592_0.jpg	severe_damage
california_wildfires	920931333848883000	Tubb #Fire #Victims #Visit the Remains of their #Home:   	data_image/california_wildfires/19_10_2017/920931333848883201_0.jpg	severe_damage
hurricane_maria	911644108523032000	#PuertoRico: 35 PIX After #HuracanMaria.  	data_image/hurricane_maria/23_9_2017/911644108523032577_0.jpg	severe_damage
hurricane_maria	911551604196872000	Only #aerial #photos help families know what is happening to their communities inside #Dominica #hurricanemaria #sos 	data_image/hurricane_maria/23_9_2017/911551604196872192_0.jpg	severe_damage
hurricane_irma	910195055180234000	Georgia residents now get Hurricane Irma tax relief  	data_image/hurricane_irma/19_9_2017/910195055180234753_0.jpg	little_or_no_damage
iraq_iran_earthquake	930438996852985000	Rescue workers in Iran search for survivors after blocks in town of 30,000 people collapsed  	data_image/iraq_iran_earthquake/14_11_2017/930438996852985856_0.jpg	severe_damage
hurricane_irma	905714507657469000	Caribbean Reeling: At Least 3 Dead From The Weather Channel iPhone App #resist  	data_image/hurricane_irma/7_9_2017/905714507657469953_0.jpg	severe_damage
hurricane_irma	909992667106496000	Cocos Nucifera (Coconut Palm) - Post Hurricane Irma / Pre Halloween fun with my downed coconut tree... via 	data_image/hurricane_irma/19_9_2017/909992667106496517_0.jpg	little_or_no_damage
california_wildfires	922633023845052000	Can California learn to cope with seasonal wildfires?  	data_image/california_wildfires/24_10_2017/922633023845052416_0.jpg	severe_damage
hurricane_maria	912288130354511000	#HurricaneMaria bringing rough surf, high risk of rip currents to Volusia, Flagler  	data_image/hurricane_maria/25_9_2017/912288130354511873_0.jpg	mild_damage
mexico_earthquake	914952139209891000	RT @latimes: 2,000 historic buildings in Mexico have been damaged by the earthquake  	data_image/mexico_earthquake/2_10_2017/914952139209891852_1.jpg	mild_damage
hurricane_harvey	905901300134461000	Congress approves $15.25bn natural disaster aid package &amp; raises US debt ceiling  	data_image/hurricane_harvey/7_9_2017/905901300134461440_0.jpg	mild_damage
california_wildfires	923498020209078000	California firefighters douse fire with direct water drop  	data_image/california_wildfires/26_10_2017/923498020209078273_0.jpg	severe_damage
hurricane_irma	909994032436191000	#POLITICS Finding Peace in Irma - and in all of Life's Storms  #NEWS 	data_image/hurricane_irma/19_9_2017/909994032436191232_0.jpg	mild_damage
hurricane_harvey	905277948395184000	RT @Religion_Newz: Knights of Columbus take action to aid Hurricane Harvey victims  	data_image/hurricane_harvey/6_9_2017/905277948395184128_0.jpg	severe_damage
hurricane_harvey	905664802214858000	Nature At Its Fiercest And Humanity At Its Best  	data_image/hurricane_harvey/7_9_2017/905664802214858752_0.jpg	severe_damage
hurricane_irma	910096842855211000	NEWS: Staffordshire man caught up in Hurricane Irma says it's left Caribbean islanders without food and shelter &gt;&gt; 	data_image/hurricane_irma/19_9_2017/910096842855211008_0.jpg	severe_damage
hurricane_irma	910122575380000000	FHWA Gives Florida DOT $25 Million for Irma Relief  	data_image/hurricane_irma/19_9_2017/910122575380000768_0.jpg	mild_damage
california_wildfires	921571773501640000	Cats affected by California wildfires being brought to Washington  	data_image/california_wildfires/21_10_2017/921571773501640709_0.jpg	little_or_no_damage
iraq_iran_earthquake	930139822718468000	More than 400 killed in Iran-Iraq quake, state media says  	data_image/iraq_iran_earthquake/13_11_2017/930139822718468097_0.jpg	severe_damage
hurricane_maria	921427706880954000	Puerto Rico death toll 450, 69 missing. Trump is a total disgrace and embarrassment to USA. INSANITY! 	data_image/hurricane_maria/20_10_2017/921427706880954369_0.jpg	mild_damage
california_wildfires	918114251574857000	California wildfires latest: 'Red alert' issued as weather conditions likely to fan flames  	data_image/california_wildfires/11_10_2017/918114251574857728_0.jpg	severe_damage
hurricane_harvey	906833200877629000	Flooded but still a beautiful city nevertheless. FF #Harvey2017 #Houston #HurricaneHarvey 	data_image/hurricane_harvey/10_9_2017/906833200877629440_0.jpg	severe_damage
hurricane_maria	913478597331050000	An update from @FeedingAmerica about disaster relief in response to #HurricaneMaria:  	data_image/hurricane_maria/28_9_2017/913478597331050496_0.jpg	severe_damage
hurricane_harvey	905035038575788000	Feds Move to Crack Down on #HurricaneHarvey Scammers -  #scams #fraud #harvey 	data_image/hurricane_harvey/5_9_2017/905035038575788032_0.jpg	mild_damage
hurricane_irma	909962301683453000	Island Homeowner Can't Believe Whats Seen At Trump's House After Irma, Quickly Snaps Photo  	data_image/hurricane_irma/19_9_2017/909962301683453952_0.jpg	mild_damage
hurricane_maria	912393267387478000	#HurricaneMaria devastated our home 4BE 	data_image/hurricane_maria/25_9_2017/912393267387478016_0.jpg	mild_damage
hurricane_irma	909978918534500000	After Irma, its Maria and it could get devastating. 	data_image/hurricane_irma/19_9_2017/909978918534500352_1.jpg	severe_damage
hurricane_harvey	906744961072291000	Houston citizens have thrown out 8 million+ cubic yards of drywall, furniture, appliances and clothing after Harvey 	data_image/hurricane_harvey/10_9_2017/906744961072291840_2.jpg	severe_damage
iraq_iran_earthquake	930268238075674000	FAQ on Iran Earthquake Relief  	data_image/iraq_iran_earthquake/14_11_2017/930268238075674624_0.jpg	severe_damage
hurricane_harvey	905164133934485000	 Found Clinging to Lifeless Mother in Hurricane Harvey Floodwaters 	data_image/hurricane_harvey/5_9_2017/905164133934485504_0.jpg	severe_damage
mexico_earthquake	910564177764171000	Powerful earthquake shook central mexico on Tuesday killing 217 . #MexicoCity #RIP 	data_image/mexico_earthquake/20_9_2017/910564177764171777_0.jpg	severe_damage
hurricane_maria	916292237700497000	RT @CustomsBorder: CBP officers help clean up destruction from #HurricaneMaria in the US Virgin Islands. 	data_image/hurricane_maria/6_10_2017/916292237700497408_1.jpg	mild_damage
california_wildfires	922617747141480000	Does California need to rethink urban fire risk after wine country tragedy?  	data_image/california_wildfires/24_10_2017/922617747141480448_0.jpg	severe_damage
hurricane_irma	909437299640778000	Nations littlest post office beats Irma  	data_image/hurricane_irma/17_9_2017/909437299640778752_0.jpg	severe_damage
hurricane_irma	909383948563869000	RT @wbaltv11: Pet owners who abandoned animals during Irma will face felony charges  	data_image/hurricane_irma/17_9_2017/909383948563869696_0.jpg	mild_damage
hurricane_irma	909382743141822000	RT @FCN2go: Local animal shelter seeking help after Irma  	data_image/hurricane_irma/17_9_2017/909382743141822466_0.jpg	little_or_no_damage
hurricane_irma	909871727932473000	Irma is still leaving her mark in some areas of FL 	data_image/hurricane_irma/18_9_2017/909871727932473345_0.jpg	little_or_no_damage
hurricane_maria	913903407718690000	WWD - Hurricane Marias Aftermath Could Last a Month and Keep Retail Shut Down  	data_image/hurricane_maria/29_9_2017/913903407718690816_0.jpg	mild_damage
california_wildfires	917828826083840000	Wildfires have ravaged areas all across California, destroying over 1500 properties  	data_image/california_wildfires/10_10_2017/917828826083840000_0.jpg	severe_damage
hurricane_maria	912023404030525000	Hurricane Maria may be coming for North Carolina and Virginia  via @nypost 	data_image/hurricane_maria/24_9_2017/912023404030525440_0.jpg	severe_damage
hurricane_irma	909930200380723000	Irma insurance claims already near $2B -  	data_image/hurricane_irma/19_9_2017/909930200380723201_0.jpg	severe_damage
hurricane_maria	913049235402002000	ideas on how to assist Puerto Rico #PuertoRico #PuertoRicoRelief  	data_image/hurricane_maria/27_9_2017/913049235402002432_0.jpg	severe_damage
california_wildfires	919928977673695000	@realDonaldTrump California is on fire awhile trump again says nothing.. 	data_image/california_wildfires/16_10_2017/919928977673695232_0.jpg	severe_damage
mexico_earthquake	913002540119330000	Insured loss estimates for Mexico earthquake up to $2bn -  	data_image/mexico_earthquake/27_9_2017/913002540119330816_0.jpg	severe_damage
mexico_earthquake	910803599680327000	Mexico Declares 3 Days Of Mourning.Check out the massive damage caused by earthquake here=&gt;  	data_image/mexico_earthquake/21_9_2017/910803599680327681_0.jpg	severe_damage
hurricane_maria	910636264419942000	First Footage From Dominica Shows 'Total Destruction'  #USRC 	data_image/hurricane_maria/20_9_2017/910636264419942400_0.jpg	severe_damage
hurricane_irma	909747923445002000	Images of #Irma. #FloridaKeys 	data_image/hurricane_irma/18_9_2017/909747923445002240_0.jpg	little_or_no_damage
hurricane_harvey	904697308947914000	#Drones prove useful to Harvey recovery , FFA issues 43 permits  #Harvey2017 	data_image/hurricane_harvey/4_9_2017/904697308947914753_0.jpg	severe_damage
iraq_iran_earthquake	929993504662720000	7.3 MAGNITUDE EARTHQUAKE HITS IRAN-IRAQ; MANY KILLED, THOUSANDSINJURED.  	data_image/iraq_iran_earthquake/13_11_2017/929993504662720512_0.jpg	severe_damage
hurricane_harvey	904361902762893000	"Let's be realistic, 50"" if Rain! What changes would prevent damage from this magnitude?  "	data_image/hurricane_harvey/3_9_2017/904361902762893313_0.jpg	severe_damage
hurricane_maria	911575707024859000	dhs_jules: RT iamalikentish: The 'cultural capital' of Dominica - Grandbay, post Hurricane Maria. Pics from my fri 	data_image/hurricane_maria/23_9_2017/911575707024859136_2.jpg	severe_damage
hurricane_maria	927955012243935000	#Puerto #Rico in need of '#Unprecedented $#21bn #Aid' to #Rec... -  - #News 	data_image/hurricane_maria/7_11_2017/927955012243935234_0.jpg	severe_damage
hurricane_maria	911786535321604000	Still suffering from Hurricane Irma, Maria smashes Caribbean 	data_image/hurricane_maria/24_9_2017/911786535321604096_0.jpg	severe_damage
hurricane_irma	905686913876582000	Irma's destruction: island by island  	data_image/hurricane_irma/7_9_2017/905686913876582401_0.jpg	mild_damage
hurricane_harvey	906200820961693000	#CHP Installation Keeps Texas Medical Center Running During #HurricaneHarvey  	data_image/hurricane_harvey/8_9_2017/906200820961693697_0.jpg	little_or_no_damage
hurricane_maria	921403830180433000	RT @DailyCaller: OPINION: We Need Financial Oversight For Puerto Ricos Hurricane Recovery  	data_image/hurricane_maria/20_10_2017/921403830180433923_0.jpg	mild_damage
hurricane_harvey	901650824530669000	RT @D1MikeyT: @KPRC2 #Harvey still causing damage and flooding 	data_image/hurricane_harvey/27_8_2017/901650824530669568_1.jpg	severe_damage
hurricane_irma	909903376875274000	Many Volusia residents still suffering one week after Irma  	data_image/hurricane_irma/18_9_2017/909903376875274240_0.jpg	mild_damage
mexico_earthquake	912359993680236000	TONIGHT!] RISE! NY / MX | Earthquake Relief for Mexico  Benefit Concert  	data_image/mexico_earthquake/25_9_2017/912359993680236554_0.jpg	severe_damage
hurricane_maria	910525745973415000	Puerto Rico is pummelled by Hurricane Maria, as flooding slowly drains from Martinique.  	data_image/hurricane_maria/20_9_2017/910525745973415938_0.jpg	severe_damage
hurricane_maria	927929692249878000	Puerto Rico needs as much as $21 billion in aid, island's overseer says  	data_image/hurricane_maria/7_11_2017/927929692249878529_0.jpg	mild_damage
hurricane_harvey	901655268215341000	Harvey: Fears grow over severe flooding risk  #myreadinglist 	data_image/hurricane_harvey/27_8_2017/901655268215341056_0.jpg	severe_damage
hurricane_harvey	906464461946531000	Texas Prisoners Describe Nightmarish Conditions, Exposure to Floodwaters Following Harvey  	data_image/hurricane_harvey/9_9_2017/906464461946531840_0.jpg	severe_damage
hurricane_maria	916341004478943000	FEMA deletes statistics on Puerto Rico hurricane response from website  mashable 	data_image/hurricane_maria/6_10_2017/916341004478943234_0.jpg	severe_damage
hurricane_irma	909477108048678000	Florida Keys landmarks after Hurricane Irma  	data_image/hurricane_irma/17_9_2017/909477108048678912_0.jpg	severe_damage
hurricane_harvey	904285919217426000	RT @CNN: Fire destroyed a family's home during #Harvey, but this Virgin Mary statue survived  	data_image/hurricane_harvey/3_9_2017/904285919217426432_0.jpg	severe_damage
hurricane_harvey	905555871069073000	Photos I took of the disastrous damage left behind by #HurricaneHarvey 	data_image/hurricane_harvey/6_9_2017/905555871069073408_0.jpg	mild_damage
hurricane_irma	909919362299043000	St. John island still in desperate situation after Irma, braces for Maria  	data_image/hurricane_irma/18_9_2017/909919362299043841_0.jpg	little_or_no_damage
hurricane_maria	928690684701184000	You're invited: Repair Puerto Rico concert on Nov. 12 to benefit storm repair  	data_image/hurricane_maria/9_11_2017/928690684701184001_0.jpg	severe_damage
california_wildfires	919563224152006000	Wildfires now up to 100 miles wide as death toll reaches 40  	data_image/california_wildfires/15_10_2017/919563224152006656_0.jpg	severe_damage
hurricane_harvey	905185045685559000	What They Saved: Texans Reflect on Treasures Plucked From Harvey #HurricaneHarvey2017 #Floods 	data_image/hurricane_harvey/5_9_2017/905185045685559297_0.jpg	severe_damage
hurricane_maria	911711789246693000	Dominican Republic: 38 towns isolated after #HurricaneMaria  	data_image/hurricane_maria/23_9_2017/911711789246693377_0.jpg	little_or_no_damage
hurricane_harvey	905793922303176000	There will be a special collection in parishes Sept. 9-10 to support #HarveyRelief  	data_image/hurricane_harvey/7_9_2017/905793922303176704_0.jpg	severe_damage
hurricane_irma	909436803853189000	#Georgia residents affected by #Irma may register for @fema assistance:  | #Savannah 	data_image/hurricane_irma/17_9_2017/909436803853189121_0.jpg	little_or_no_damage
hurricane_maria	912419318054371000	Puerto Rico governor fears humanitarian crisis in wake of Hurricane Maria  World #CBC  	data_image/hurricane_maria/25_9_2017/912419318054371328_0.jpg	severe_damage
california_wildfires	919729752835022000	Northern California wine country has been devastated as a series of dangerous fires continue  	data_image/california_wildfires/16_10_2017/919729752835022848_0.jpg	severe_damage
hurricane_maria	910525461465321000	Aerial footage shows devastation in #Dominica after #Hurricane #Maria  video  #twitter 	data_image/hurricane_maria/20_9_2017/910525461465321472_0.jpg	severe_damage
california_wildfires	920670466121125000	Why Are Incarcerated Women Battling California Wildfires for as Little as $1 a Day?  	data_image/california_wildfires/18_10_2017/920670466121125890_0.jpg	severe_damage
hurricane_irma	905630580745830000	RT @AmichaiStein1: #BREAKING: Hurricane Irma destroys '95%' of French part of Caribbean island St Martin: official 	data_image/hurricane_irma/7_9_2017/905630580745830400_2.jpg	mild_damage
hurricane_maria	921382178625335000	One month later, most of Puerto Rico is still utterly destroyed.  	data_image/hurricane_maria/20_10_2017/921382178625335296_0.jpg	mild_damage
hurricane_irma	910169542718091000	Dodged a lot of fallen trees on this morning's detour #IRMA 	data_image/hurricane_irma/19_9_2017/910169542718091265_1.jpg	little_or_no_damage
hurricane_harvey	905095591675518000	RT @gcitytimes: Toxic Air Pollution is One of Harveys Unseen Dangers -  	data_image/hurricane_harvey/5_9_2017/905095591675518976_0.jpg	severe_damage
hurricane_irma	909412901626236000	Atlanta loves its urban forest despite damage wrought by Irma:  	data_image/hurricane_irma/17_9_2017/909412901626236929_0.jpg	little_or_no_damage
hurricane_maria	929033551885959000	Puerto Rico is really as bad as you see in the news. Hey #DonaldTrump time for some action! 	data_image/hurricane_maria/10_11_2017/929033551885959169_0.jpg	little_or_no_damage
hurricane_irma	909829094854062000	Homes Built to Stricter Building Codes Fared Better in the Storm. #HurricaneIrma  	data_image/hurricane_irma/18_9_2017/909829094854062082_0.jpg	little_or_no_damage
california_wildfires	918095131689013000	Bottles sucked dry of wine among charred California wildfire remains  	data_image/california_wildfires/11_10_2017/918095131689013248_0.jpg	severe_damage
hurricane_maria	911869898703474000	Heres How You Can Help People Affected By HurricaneMaria  	data_image/hurricane_maria/24_9_2017/911869898703474689_0.jpg	severe_damage
california_wildfires	922632288638205000	California launching fire clean-up 'for the record books'  	data_image/california_wildfires/24_10_2017/922632288638205952_0.jpg	severe_damage
hurricane_irma	909387208599142000	Hurricane Irma shows Donald Trump isnt Americas only problem, writes @WilbyPeter  	data_image/hurricane_irma/17_9_2017/909387208599142400_0.jpg	little_or_no_damage
hurricane_maria	910624383978192000	Merciless Hurricane Maria lashes across the Caribbean leaving thousands homeless  	data_image/hurricane_maria/20_9_2017/910624383978192898_0.jpg	mild_damage
hurricane_harvey	904253626457174000	RT @chavismophoto: ##Photos from #BaytownStrong in #Texas #HurricaneHarvey #PhotojPhotography for @washingtonpost 	data_image/hurricane_harvey/3_9_2017/904253626457174016_3.jpg	severe_damage
california_wildfires	917871713823502000	@RealOmarNavarro @SchnauzerMom777 Can You Stop the Weather Wars  	data_image/california_wildfires/10_10_2017/917871713823502336_0.jpg	severe_damage
hurricane_irma	910225493877813000	Work ongoing to repair damage to #edistobeach post Irma. Lots of sand, barriers out of place @ABCNews4 #chstrfc #chs 	data_image/hurricane_irma/19_9_2017/910225493877813249_1.jpg	little_or_no_damage
hurricane_maria	921433090177863000	Trump's 10 out of 10: Nearly 80% of Puerto Rico Is Still in the Dark  	data_image/hurricane_maria/20_10_2017/921433090177863680_0.jpg	severe_damage
california_wildfires	917818995377569000	California wildfires hit wine country, burning hotels and threatening vineyards 	data_image/california_wildfires/10_10_2017/917818995377569793_0.jpg	severe_damage
hurricane_irma	909748542666887000	Woman gets help after dealing with Irma and Matthew  	data_image/hurricane_irma/18_9_2017/909748542666887173_0.jpg	little_or_no_damage
california_wildfires	920274579163176000	RT @latimes: Why 2017 is shaping up to be one of Californias worst fire seasons  	data_image/california_wildfires/17_10_2017/920274579163176961_0.jpg	severe_damage
hurricane_irma	909748987862888000	Oh noes. BVI has so little left to blow over. #HogHeavenVirginGorda  	data_image/hurricane_irma/18_9_2017/909748987862888448_0.jpg	mild_damage
iraq_iran_earthquake	930019166907719000	UPDATED: 300 people die in earthquake between Iran and Iraq -  	data_image/iraq_iran_earthquake/13_11_2017/930019166907719681_0.jpg	severe_damage
hurricane_maria	910559723770040000	Statia after #hurricane #Maria. High waves on #Caribbean side and boulders thrown on shore #Kingdom St #Eustatius 	data_image/hurricane_maria/20_9_2017/910559723770040326_1.jpg	severe_damage
hurricane_harvey	904216916889186000	Texas on long road to recovery 9 days after Harvey  	data_image/hurricane_harvey/3_9_2017/904216916889186305_0.jpg	severe_damage
hurricane_irma	909446703237009000	We have sent an emergency crew to Florida to help out with Hurricane Irma cleanup - Call 612-532-9996 #bonitasprings 	data_image/hurricane_irma/17_9_2017/909446703237009408_0.jpg	mild_damage
hurricane_harvey	910160788849008000	Pearl Fincher Museum continues post-Harvey cleanup efforts  	data_image/hurricane_harvey/19_9_2017/910160788849008640_0.jpg	mild_damage
california_wildfires	923761170967797000	GOP targets environmental rules after California wildfires  	data_image/california_wildfires/27_10_2017/923761170967797761_0.jpg	severe_damage
mexico_earthquake	914952139209891000	RT @latimes: 2,000 historic buildings in Mexico have been damaged by the earthquake  	data_image/mexico_earthquake/2_10_2017/914952139209891852_0.jpg	severe_damage
hurricane_maria	914880414736699000	#IRS offers #MariaRelief throughout #USVirginIslands and #PuertoRico.  	data_image/hurricane_maria/2_10_2017/914880414736699393_0.jpg	severe_damage
california_wildfires	918236509689479000	RT @latimes: Column: As California burns, here's what you need to know about fire insurance  	data_image/california_wildfires/11_10_2017/918236509689479168_0.jpg	severe_damage
